{"count":4703,"document_count":23328,"next":"https://www.courtlistener.com/api/rest/v4/search/?cursor=cz0xMzQ0MjExMjAwMDAwMC4wJnM9NzIwNTM1NzkmdD1yJmQ9MjAyNi0wMi0xMyZwPTI%3D&order_by=dateFiled+desc&page_size=20&q=Jeffrey+Epstein&type=r","previous":null,"results":[{"assignedTo":null,"assigned_to_id":null,"attorney":["Paul J. Orfanedes"],"attorney_id":[11273780],"caseName":"JUDICIAL WATCH, INC. v. U.S. DEPARTMENT OF THE TREASURY","case_name_full":"","cause":"05:552 Freedom of Information Act","chapter":null,"court":"District Court, District of Columbia","court_citation_string":"D.D.C.","court_id":"dcd","dateArgued":null,"dateFiled":"2026-02-12","dateTerminated":null,"docketNumber":"1:26-cv-00446","docket_absolute_url":"/docket/72272680/judicial-watch-inc-v-us-department-of-the-treasury/","docket_id":72272680,"firm":["Judicial Watch, Inc."],"firm_id":[56957],"jurisdictionType":"U.S. Government Defendant","juryDemand":"None","meta":{"timestamp":"2026-02-13T17:20:17.820655Z","date_created":"2026-02-12T20:17:57.348114Z","score":{"bm25":13446950000000.0},"more_docs":false},"pacer_case_id":"289344","party":["DEPARTMENT OF THE TREASURY","JUDICIAL WATCH, INC."],"party_id":[17315924,17315925],"recap_documents":[{"absolute_url":"/docket/72272680/1/judicial-watch-inc-v-department-of-the-treasury/","attachment_number":null,"cites":[],"description":"COMPLAINT against DEPARTMENT OF THE TREASURY ( Filing fee $ 405 receipt number ADCDC-12241940) filed by JUDICIAL WATCH, INC.. (Attachments: # 1 Civil Cover Sheet, # 2 Summons Treasury, # 3 Summons US Atty for DC, # 4 Summons US Atty General)(Orfanedes, Paul) (Entered: 02/12/2026)","docket_entry_id":453708561,"document_number":1,"document_type":"PACER Document","entry_date_filed":"2026-02-12","entry_number":1,"filepath_local":"recap/gov.uscourts.dcd.289344/gov.uscourts.dcd.289344.1.0.pdf","id":468605975,"is_available":true,"meta":{"timestamp":"2026-02-13T17:20:17.839299Z","date_created":"2026-02-12T20:29:55.978522Z"},"pacer_doc_id":"045011907402","page_count":4,"short_description":"Complaint","snippet":"            Case 1:26-cv-00446        Document 1        Filed 02/12/26      Page 1 of 4\n\n\n\n\n                        IN THE UNITED STATES DISTRICT COURT\n                           FOR THE DISTRICT OF COLUMBIA\n\nJUDICIAL WATCH, INC.,               )\n425 Third Street SW, Suite 800      )\nWashington, DC 20024,               )\n                                    )\n                    Plaintiff,      )\n                                    )                 Civil Action No.\nv.                            "}],"referredTo":null,"referred_to_id":null,"suitNature":"895 Freedom of Information Act","trustee_str":null},{"assignedTo":null,"assigned_to_id":null,"attorney":["Mary F. Caloway"],"attorney_id":[11270255],"caseName":"Avenger Flight Group Mexico II, S. DE R.L. DE C.V.","case_name_full":"","cause":"","chapter":"11","court":"United States Bankruptcy Court, D. Delaware","court_citation_string":"Bankr. D. Del.","court_id":"deb","dateArgued":null,"dateFiled":"2026-02-12","dateTerminated":null,"docketNumber":"26-10201","docket_absolute_url":"/docket/72267190/avenger-flight-group-mexico-ii-s-de-rl-de-cv/","docket_id":72267190,"firm":["Pachulski Stang Ziehl & Jones"],"firm_id":[715244],"jurisdictionType":"","juryDemand":"","meta":{"timestamp":"2026-02-12T06:16:26.915942Z","date_created":"2026-02-12T06:16:26.834779Z","score":{"bm25":13446950000000.0},"more_docs":false},"pacer_case_id":"200441","party":["Avenger Flight Group Mexico II, S. DE R.L. DE C.V.","U.S. Trustee"],"party_id":[17310027,17310028],"recap_documents":[{"absolute_url":"/docket/72267190/1/1/avenger-flight-group-mexico-ii-s-de-rl-de-cv/","attachment_number":1,"cites":[6967884],"description":"Chapter 11 Voluntary Petition . Fee Amount $1738. Filed by Avenger Flight Group Mexico II, S. DE R.L. DE C.V.. (Attachments: # 1 Certification and Creditor Matrix) (Caloway, Mary) (Entered: 02/12/2026)","docket_entry_id":453622783,"document_number":1,"document_type":"Attachment","entry_date_filed":"2026-02-12","entry_number":1,"filepath_local":"recap/gov.uscourts.deb.200441/gov.uscourts.deb.200441.1.1.pdf","id":468522700,"is_available":true,"meta":{"timestamp":"2026-02-12T09:11:57.443372Z","date_created":"2026-02-12T09:09:41.147741Z"},"pacer_doc_id":"042022831905","page_count":41,"short_description":"Certification and Creditor Matrix","snippet":"                      Case 26-10201        Doc 1-1       Filed 02/12/26        Page 1 of 41\n\n\n\n\n                               IN THE UNITED STATES BANKRUPTCY COURT\n                                    FOR THE DISTRICT OF DELAWARE\n\nIn re:                                                                 Chapter 11\n\nAvenger Flight Group Mexico II, S. DE R.L. DE C.V.,1                   Case No. 26-[_____] (___)\n\n                                   Debtor.                             (Joint Administra"}],"referredTo":null,"referred_to_id":null,"suitNature":"","trustee_str":""},{"assignedTo":null,"assigned_to_id":null,"attorney":["Mary F. Caloway"],"attorney_id":[11270243],"caseName":"AFG Latam Sim Holdings III, LLC","case_name_full":"","cause":"","chapter":"11","court":"United States Bankruptcy Court, D. Delaware","court_citation_string":"Bankr. D. Del.","court_id":"deb","dateArgued":null,"dateFiled":"2026-02-12","dateTerminated":null,"docketNumber":"26-10191","docket_absolute_url":"/docket/72267159/afg-latam-sim-holdings-iii-llc/","docket_id":72267159,"firm":["Pachulski Stang Ziehl & Jones"],"firm_id":[715244],"jurisdictionType":"","juryDemand":"","meta":{"timestamp":"2026-02-12T05:56:26.015052Z","date_created":"2026-02-12T05:56:25.919664Z","score":{"bm25":13446950000000.0},"more_docs":false},"pacer_case_id":"200431","party":["U.S. Trustee","AFG Latam Sim Holdings III, LLC"],"party_id":[17310003,17310004],"recap_documents":[{"absolute_url":"/docket/72267159/1/1/afg-latam-sim-holdings-iii-llc/","attachment_number":1,"cites":[6967884],"description":"Chapter 11 Voluntary Petition . Fee Amount $1738. Filed by AFG Latam Sim Holdings III, LLC. (Attachments: # 1 Certification and Creditor Matrix) (Caloway, Mary) (Entered: 02/12/2026)","docket_entry_id":453615751,"document_number":1,"document_type":"Attachment","entry_date_filed":"2026-02-12","entry_number":1,"filepath_local":"recap/gov.uscourts.deb.200431/gov.uscourts.deb.200431.1.1.pdf","id":468522581,"is_available":true,"meta":{"timestamp":"2026-02-12T08:54:51.172382Z","date_created":"2026-02-12T08:54:12.017082Z"},"pacer_doc_id":"042022831758","page_count":41,"short_description":"Certification and Creditor Matrix","snippet":"                      Case 26-10191        Doc 1-1       Filed 02/12/26        Page 1 of 41\n\n\n\n\n                               IN THE UNITED STATES BANKRUPTCY COURT\n                                    FOR THE DISTRICT OF DELAWARE\n\nIn re:                                                                 Chapter 11\n\nAFG Latam Sim Holdings III, LLC,1                                      Case No. 26-[_____] (___)\n\n                                   Debtor.                             (Joint Administra"}],"referredTo":null,"referred_to_id":null,"suitNature":"","trustee_str":""},{"assignedTo":"Thomas D. Schroeder","assigned_to_id":2873,"attorney":["PRESIDENTIAL COMMITTEE/POLITICAL ACTION COMMITTEE/SEPARATE SEGREGATED FUND (SSF) NUMBER C00569897","RONALD SATISH EMRIT"],"attorney_id":[11232305,11211651],"caseName":"PRESIDENTIAL CANDIDATE NUMBER P60005535 v. CHERNIAVSKA OF WARSAW, POLAND","case_name_full":"","cause":"28:1331 Fed. Question","chapter":null,"court":"District Court, M.D. North Carolina","court_citation_string":"M.D.N.C.","court_id":"ncmd","dateArgued":null,"dateFiled":"2026-01-23","dateTerminated":null,"docketNumber":"1:26-cv-00085","docket_absolute_url":"/docket/72184384/presidential-candidate-number-p60005535-v-cherniavska-of-warsaw-poland/","docket_id":72184384,"firm":["Ronald Satish Emrit"],"firm_id":[241134],"jurisdictionType":"Diversity","juryDemand":"None","meta":{"timestamp":"2026-02-01T08:27:19.570330Z","date_created":"2026-01-23T22:38:01.477568Z","score":{"bm25":13445222000000.0},"more_docs":false},"pacer_case_id":"103929","party":["WORLD BANK","RONALD SATISH EMRIT","KATERYNA OLOKOBA OF KHERSON,UKRAINE","INTERNATIONAL COURT OF JUSTICE OF HAGUE, NETHERLANDS","MARIA CHERNIAVSKA OF WARSAW, POLAND","ESTATE OF ALEXEI NAVALNY","UKRAINE","DARYA IGNATEVA OF KYIV, UKRAINE","ERIN BURNETT","COUNCIL ON FOREIGN RELATIONS","VOLODYMYR ZELENSKYY","UNITED NATIONS (UN)","PRESIDENTIAL COMMITTEE/POLITICAL ACTION COMMITTEE/SEPARATE SEGREGATED FUND (SSF) NUMBER C00569897","INTERNATIONAL MONETARY FUND (IMF)"],"party_id":[17196704,17196705,17196706,17196707,17196708,17196709,17231131,17196697,17196698,17196699,17196700,17196701,17196702,17196703],"recap_documents":[{"absolute_url":"/docket/72184384/2/presidential-candidate-number-p60005535-v-cherniavska-of-warsaw-poland/","attachment_number":null,"cites":[],"description":"COMPLAINT against All Defendants, filed by PRESIDENTIAL COMMITTEE/POLITICAL ACTION COMMITTEE/SEPARATE SEGREGATED FUND (SSF) NUMBER C00569897, PRESIDENTIAL CANDIDATE NUMBER P60005535. (Attachments: # 1 Envelope - Front and Back). (lks) (Entered: 01/25/2026)","docket_entry_id":451508726,"document_number":2,"document_type":"PACER Document","entry_date_filed":"2026-01-23","entry_number":2,"filepath_local":"recap/gov.uscourts.ncmd.103929/gov.uscourts.ncmd.103929.2.0.pdf","id":466352354,"is_available":true,"meta":{"timestamp":"2026-02-01T08:28:44.972331Z","date_created":"2026-01-25T23:19:03.635070Z"},"pacer_doc_id":"13304707294","page_count":12,"short_description":"Complaint","snippet":"IN THE UNITED STATES DISTRICT COURT FOR THE\nMIDDLE DISTRICT OF NORTH CAROLINA\n(John Hervey Wheeler Courthouse, 323 E. Chapel Hill Street,\nDurham, NC 27701,P.0. Box 1091, Durham, NC 277071 )\n\nPresidential Candidate Number P60005535 [s / ait BiG\n“also known as” (aka) Ronald Satish Emrit, lh a\n\\o\\ | {i\n\n)\n)\n\n& Presidential Committee/Political Action ) NA Se\n)\n\n—\nND\n\nCommittee/Separate Segregated Fund (SSF)\nNumber C00569897 d/b/a United\n\nEmrits of America )\nPlaintiffs (Pro Se) )\n) C. A.No.: 1:26CV85"}],"referredTo":"Lawrence Patrick Auld","referred_to_id":9360,"suitNature":"360 P.I.: Other","trustee_str":null},{"assignedTo":null,"assigned_to_id":null,"attorney":["Jeffrey D. Robinson","Brent Kideckel","George Bradley Breen, Esquire","Natalia Marte"],"attorney_id":[11223128,11223129,11223130,11223131],"caseName":"Brent Kideckel v. Foreign Nation of Canada","case_name_full":"","cause":"","chapter":null,"court":"Court of Appeals for the D.C. Circuit","court_citation_string":"D.C. Cir.","court_id":"cadc","dateArgued":null,"dateFiled":"2026-01-23","dateTerminated":null,"docketNumber":"26-7006","docket_absolute_url":"/docket/72183783/brent-kideckel-v-foreign-nation-of-canada/","docket_id":72183783,"firm":["Direct: 202-861-1823, Epstein Becker & Green, PC, Firm: 202-861-0900","Direct: 202-617-2712, Phillips Lytle LLP","Direct: 917-634-0637, Firm: 917-634-0637","Direct: 202-833-8900, Lewis Baach Kaufmann Middlemiss PLLC"],"firm_id":[930185,1156787,1156788,1156789],"jurisdictionType":"","juryDemand":"","meta":{"timestamp":"2026-01-28T21:54:48.442100Z","date_created":"2026-01-23T21:39:17.494239Z","score":{"bm25":13445222000000.0},"more_docs":false},"pacer_case_id":"42820","party":["Province of Ontario Canada","David J.N. Wilson","Dahlia Saibil","Doug Downey, Attorney General of Ontario","Brent Kideckel","David Kideckel","John Doe 1-15","Aram Simovonian","Foreign Nation of Canada","City of Toronto Canada"],"party_id":[17216832,17216823,17216824,17216825,17216826,17216827,17216828,17216829,17216830,17216831],"recap_documents":[{"absolute_url":"/docket/72183783/01208815889/brent-kideckel-v-foreign-nation-of-canada/","attachment_number":null,"cites":[106497,112748,145900,186524,186645,510960,538785,583856,702289,736199,1400196,1485590,1761415,2421482,2453362,2540290,2661381,2662019,2662770,3156227,4184088,4908210,7248771,8457619,8734698,9431516,9432322,9435339],"description":"NOTICE OF APPEAL [2155810] seeking review of a decision by the U.S. District Court in 1:24-cv-02907-CJN filed by Brent Kideckel. Appeal assigned USCA Case Number: 26-7006. [26-7006] [Entered: 01/23/2026 03:27 PM]","docket_entry_id":451910993,"document_number":1208815889,"document_type":"PACER Document","entry_date_filed":"2026-01-23","entry_number":1208815889,"filepath_local":"recap/gov.uscourts.cadc.42820/gov.uscourts.cadc.42820.01208815889.0.pdf","id":466765805,"is_available":true,"meta":{"timestamp":"2026-01-29T01:34:45.228132Z","date_created":"2026-01-28T21:54:49.064221Z"},"pacer_doc_id":"01208815889","page_count":33,"short_description":"","snippet":"    Case 1:24-cv-02907-CJN Document 160             Filed 01/18/26 Page 1 of 33\nUSCA Case #26-7006    Document #2155810                Filed: 01/23/2026 Page 1 of 33\n\n                                             APPEAL,CLOSED,E−NTC,JURY,PROSE−NP,TYPE−F\n                                  U.S. District Court\n                       District of Columbia (Washington, DC)\n                 CIVIL DOCKET FOR CASE #: 1:24−cv−02907−CJN\n\n KIDECKEL v. FOREIGN NATION OF CANADA et al              Date Filed: 10"}],"referredTo":null,"referred_to_id":null,"suitNature":"3370 Other Fraud","trustee_str":null},{"assignedTo":null,"assigned_to_id":null,"attorney":["Bryn Anderson Williams","Douglas L. Davis","Cameron Ross Capps","Fred Nishihira","Amy Hanson, Assistant Attorney General","Daniel Edward Haar, Attorney","William Francis Cavanaugh, Jr.","Nicholas M. Vaz, Esquire","Austin Ostiguy","Jonathan Edward Farmer, Assistant Attorney General","John David McDowell, Assistant Attorney General","Jayme L. Weber, Attorney","Amanda J. Wentz","John E. Schmidtlein","Mark S. Popofsky, Attorney","Logan Winkles","Tyler Corcoran","Elin Alm, Assistant Attorney General","Joshua Daniel Abram","Scott Allen Mertens, Assistant Attorney General","Benjamin J. Horwich, Attorney","Jacob Frasch","Yvette K. Lafrentz","Nicole Demers","Tyler Timothy Henry","Ashwin P. Phatak","John K. Olson, Esquire, Deputy Attorney General","Brandon Garod","Michael A. Undorf, Esquire","Gina Ko, Acting Assistant Attorney General","Sarah A. Hunger, Assistant Attorney General","Justin Paul Raphael","Christopher J. Curtis, Esquire, Assistant Attorney General","Judith Paquin","Lee Istrail","DOJ Appellate Counsel","Tessa Gellerson","Brian Matthew Yost","Elizabeth Baker Murrill, Esquire, Assistant Attorney General","Scott Leroy Barnhart, Chief Counsel and Director of Consumer Protection","Amy Pauli, Assistant Attorney General","Pablo Tufino","Abiola G. Miles","Christopher Teters","Philip Levitz, Attorney","Schonette Walker","Laura McFarlane","Stephen N. Provazza","Justin Clifford McCully","Matthew Alan Michaloski, Deputy Attorney General","Elinor R. Hoffmann","Alice Aixin Wang","Alison Esbeck","Robert Acheson Koch","Jeff Pickett","Rodney I. Kimura, Esquire, Deputy Attorney General","Donald B. Verrilli, Jr., Attorney","James Wellner Doggett, Esquire, Deputy Solicitor General","Noah Goerlitz","Christian Brian Corrigan","Michelle C. Badorine, Senior Deputy Attorney General","Conor J. May","Paula L. Blizzard, Supervising Deputy Attorney General","Diamante A. Smith, Attorney","Caroline S. Van Zile, Deputy Solicitor General","Mary Gibson Jowers","Christina M. Moylan, Assistant Attorney General","Matthew A. Waring","Nickolai Gilford Levin, Attorney","Crystal Utley Secoy","Marie W. L. Martin","Jennifer L. Pratt, Assistant Attorney General","Zach Biesanz","Jonathan B. Sallet, General Counsel","Jennifer Ellen Greaney","Tracy Wright Wertz, Esquire","Patrick Michael Kuhlmann"],"attorney_id":[11243786,11243787,11243788,11243789,11243790,11241344,11241345,11241346,11241347,11241348,11241349,11241350,11241351,11241352,11241353,11241354,11241355,11241356,11241357,11241358,11205548,11205549,11205550,11205551,11205552,11205553,11205554,11205555,11205556,11205557,11205558,11250607,11205560,11205561,11205562,11205563,11205564,11205565,11205566,11205567,11205568,11205569,11205570,11205571,11205572,11205573,11205574,11205575,11205576,11205577,11205578,11205579,11205580,11205581,11205582,11205583,11205584,11205585,11205586,11205587,11205588,11205589,11205590,11205591,11205592,11205593,11205594,11205595,11205596,11205597,11205598,11205599,11205600,11205601,11205602,11257851,11257852],"caseName":"USA v. Google LLC","case_name_full":"","cause":"","chapter":null,"court":"Court of Appeals for the D.C. Circuit","court_citation_string":"D.C. Cir.","court_id":"cadc","dateArgued":null,"dateFiled":"2026-01-22","dateTerminated":null,"docketNumber":"26-5023","docket_absolute_url":"/docket/72179116/usa-v-google-llc/","docket_id":72179116,"firm":["Direct: 410-576-6470, Office of the Attorney General","Direct: 312-814-5202, Office of the Attorney General, State of Illinois, Firm: 312-814-3000","Direct: 803-734-3996, Office of the Attorney General, State of South Carolina, Firm: 803-734-3680","Office of the Attorney General of Guam, Firm: 671-475-3324","Direct: 520-628-6609, Office of the Arizona Attorney General","Office of the Attorney General, State of Rhode Island, Firm: 401-274-4400","Direct: 501-682-1178, Office of the Arkansas Attorney General, Firm: 501-682-2007","Direct: 207-626-8838, Office of the Attorney General, State of Maine, Firm: 207-626-8800","Direct: 401-274-4400, Office of the Attorney General, State of Rhode Island, Firm: 401-274-4400","Direct: 971-673-1880, OREGON DEPARTMENT OF JUSTICE","Direct: 802-828-5586, Office of the Attorney General, State of Vermont, Firm: 802-828-3171","Direct: 202-803-0500, U.S. Department of Justice, (DOJ) Antitrust Division, Appellate Section, Firm: 202-514-2413","Direct: 615-770-1714, Office of Tennessee Attorney General","Direct: 212-416-6325, New York State Office of the Attorney General, Appeals & Opinions Bureau","Consumer Protection Division, Firm: 601-359-4213, Post","Direct: 405-522-0858, Office of the Attorney General, State of Oklahoma","Direct: 919-716-6400, North Carolina Department of Justice, Firm: 919-716-6400","Direct: 661-917-4482, Office of the Attorney General","Direct: 860-808-5030, Office of the Attorney General, State of Connecticut","Direct: 617-963-2981, Massachusetts Office of the Attorney General","Direct: 785-368-8429, Office of the Kansas Attorney General, Firm: 785-296-3751","Direct: 505-490-4885, Office of the Attorney General, State of New Mexico, Firm: 505-827-6000","Office of the Attorney General for the District of Columbia, Firm: 202-727-3400","Direct: 804-692-0485, Office of the Attorney General of Virginia, Antitrust Unit","Direct: 317-232-6309, Office of the Indiana Attorney General, Firm: 317-234-6843","Direct: 202-508-4624, Ropes & Gray LLP, Firm: 202-508-4600","Direct: 787-725-6655, U.S. Department of Justice, (DOJ) Office of Legal Counsel","Direct: 701-328-5570, Office of Attorney General, State of North Dakota, Consumer Protection & Antitrust Division, Suite C, Firm: 701-328-5570","Direct: 208-332-3549, Idaho Office of the Attorney General","Office of the Attorney General for the District of Columbia, Office of the Solicitor General, Firm: 202-727-3400","Direct: 919-716-6015, North Carolina Department of Justice","Direct: 615-532-7271, Office of the Attorney General, State of Tennessee","U.S. Department of Justice, (DOJ) Civil Division, Appellate Staff, Firm: 202-514-2000","Direct: 385-270-2164, Office of the Attorney General, State of Utah","Direct: 502-696-5448, Office of the Attorney General, Commonwealth of Kentucky, Firm: 502-696-5300","Direct: 202-514-2886, U.S. Department of Justice, (DOJ) Antitrust Division, Appellate Section, Office 3229, Firm: 202-514-2413","Direct: 302-683-8816, Delaware Department of Justice, 5th Floor, Firm: 302-577-8600","Direct: 615-741-7663, Office of the Attorney General, State of Tennessee","Direct: 808-586-1180, State of Hawaii Department of the Attorney General, Firm: 808-586-1282","Direct: 404-458-3236, Office of the Attorney General, State of Georgia, Firm: 404-656-0397","Direct: 720-508-6199, Colorado Office of the Attorney General, Consumer Protection Section, Antitrust Unit, Firm: 720-508-6000","Direct: 651-757-1257, Office of the Attorney General, State of Minnesota, Firm: 651-296-3353","Direct: 212-335-2793, Patterson Belknap Webb & Tyler LLP, Firm: 212-336-2000","Direct: 307-777-8240, Office of the Attorney General, State of Wyoming","Direct: 624-466-4872, Office of the Attorney General, State of Ohio, Antitrust Section","Direct: 225-326-6766, Louisiana Department of Justice, Firm: 225-326-6300","Direct: 503-378-4402, Oregon Department of Justice, Appellate Division","Direct: 202-305-4639, U.S. Department of Justice, (DOJ) Antitrust Division","Direct: 202-532-4186, U.S. Department of Justice, (DOJ) Antitrust Division","Direct: 609-376-2383, Office of the Attorney General, State of New Jersey, Firm: 609-984-4863","Direct: 415-512-4066, Munger Tolles & Olson, LLP","Direct: 661-917-4482, Office of the Attorney General, State of Texas","Direct: 202-220-1101, Munger, Tolles & Olson LLP, Firm: 202-220-1100","Direct: 202-434-5901, Williams & Connolly LLP, Firm: 202-434-5000","Direct: 720-508-6000, Colorado Department of Law","Direct: 415-512-4085, Munger, Tolles & Olson LLP","Direct: 406-444-2707, Montana Department of Justice, Firm: 406-444-2026","Direct: 775-684-1164, Office of the Attorney General, State of Nevada","Direct: 206-464-5419, Office of the Attorney General, State of Washington, Firm: 206-464-7744","Direct: 720-508-6000, Colorado Department of Law, Office of the Attorney General","Direct: 872-276-3598, Office of the Attorney General, State of Illinois, Firm: 312-814-3000","Direct: 415-510-3765, California Department of Justice, Firm: 415-703-5500","Direct: 801-440-9825, Office of the Utah Attorney General","Direct: 608-266-8911, Wisconsin Department of Justice, Firm: 608-266-5410","Direct: 202-724-6635, Office of the Attorney General for the District of Columbia, Firm: 202-727-3400","Direct: 605-773-3215, Office of the Attorney General, State of South Dakota","Direct: 603-271-1217, Office of the Attorney General, State of New Hampshire, Firm: 603-271-3658","Direct: 202-598-2846, U.S. Department of Justice, (DOJ) Antitrust Division, Appellate Section, Firm: 202-514-2413","Direct: 517-335-7659, Michigan Department of Attorney General","Direct: 212-416-8269, New York State Office of the Attorney General","Direct: 304-558-8986, Office of the Attorney General, State of West Virginia, Consumer Protection and Antitrust Division","Direct: 402-471-9305, Nebraska Department of Justice","Direct: 314-340-4977, Office of the Missouri Attorney General","Direct: 907-269-5275, Office of the Attorney General, State of Alaska"],"firm_id":[333569,592386,454659,856341,837015,1035674,1035675,811166,1035678,1035679,1035680,1035681,1035682,1035683,1023915,1023917,995889,1159217,1158836,1158837,1158838,910137,1092922,910140,330174,910143,1154805,910148,1117124,804038,935368,910155,1154807,910157,1154808,852053,1015126,1154809,816600,816601,955610,1015128,1015130,1023738,1154810,1154811,361952,816608,816610,361956,816613,1075174,816615,1087592,816617,998378,1087593,1154798,361967,1154799,1154800,1154801,1154802,816628,825461,924405,816631,1106422,1023737,816634,816635,1154803,1154804,798334,1154806],"jurisdictionType":"","juryDemand":"","meta":{"timestamp":"2026-01-23T01:02:30.626826Z","date_created":"2026-01-23T01:02:30.507819Z","score":{"bm25":13445136000000.0},"more_docs":false},"pacer_case_id":"42811","party":["State of Idaho, 20-3715","State of Rhode Island, 20-3715","Google LLC","State of Oregon, 20-3715","State of Arkansas","State of California","State of Washington, 20-3715","State of New Jersey, 20-3715","Territory of Guam, 20-3715","State of Maine, 20-3715","State of Alaska, 20-3715","State of South Dakota, 20-3715","Commonwealth of Virginia, 20-3715","State of Hawaii, 20-3715","State of Texas","State of Kansas, 20-3715","Commonwealth of Massachusetts, 20-3715","State of New York, 20-3715","District of Columbia, 20-3715","State of Minnesota, 20-3715","State of Indiana","United States of America","Commonwealth of Puerto Rico, 20-3715","State of Louisiana","State of Wisconsin","State of North Dakota, 20-3715","State of Maryland, 20-3715","State of Michigan","State of Vermont, 20-3715","State of North Carolina, 20-3715","State of Arizona, 20-3715","State of Tennessee, 20-3715","State of West Virginia, 20-3715","State of Montana","State of Georgia","Commonwealth of Kentucky","State of Iowa, 20-3715","State of Wyoming, 20-3715","State of Missouri","State of Utah, 20-3715","State of Colorado, 20-3715","State of New Hampshire, 20-3715","State of Connecticut, 20-3715","State of Oklahoma, 20-3715","State of Illinois, 20-3715","State of Nebraska, 20-3715","State of Florida","State of Nevada, 20-3715","State of Ohio, 20-3715","Commonwealth of Pennsylvania, 20-3715","State of New Mexico, 20-3715","State of Mississippi","State of Delaware, 20-3715","State of South Carolina"],"party_id":[17187214,17187215,17187216,17187217,17187218,17187219,17187220,17187221,17187222,17187223,17187224,17187225,17187226,17187227,17187228,17187229,17187230,17187231,17187232,17187233,17187234,17187235,17187236,17187237,17187238,17187239,17187240,17187241,17187242,17187243,17187244,17187245,17187246,17187247,17187248,17187249,17187250,17187251,17187252,17187253,17187254,17187255,17187256,17187257,17187258,17187259,17187260,17187261,17187262,17187263,17187264,17187265,17187266,17187267],"recap_documents":[{"absolute_url":"/docket/72179116/01208815425/usa-v-google-llc/","attachment_number":null,"cites":[1759874,2471745,2476144,7246871,7844347,8415257,8712287,9804990],"description":"NOTICE OF APPEAL [2155558] seeking review of a decision by the U.S. District Court in 1:20-cv-03010-APM, 1:20-cv-03715-APM filed by Google LLC. Appeal assigned USCA Case Number: 26-5023. [26-5023] [Entered: 01/22/2026 06:06 PM]","docket_entry_id":451253582,"document_number":1208815425,"document_type":"PACER Document","entry_date_filed":"2026-01-22","entry_number":1208815425,"filepath_local":"recap/gov.uscourts.cadc.42811/gov.uscourts.cadc.42811.01208815425.0.pdf","id":466091613,"is_available":true,"meta":{"timestamp":"2026-01-28T21:57:34.688961Z","date_created":"2026-01-23T01:02:30.769948Z"},"pacer_doc_id":"01208815425","page_count":331,"short_description":"","snippet":"   Case 1:20-cv-03010-APM Document 1473          Filed 01/20/26 Page 1 of 331\nUSCA Case #26-5023    Document #2155558           Filed: 01/22/2026 Page 1 of 331\n\n                                                        APPEAL,CLOSED,CONSOL,TYPE−A\n                               U.S. District Court\n                    District of Columbia (Washington, DC)\n              CIVIL DOCKET FOR CASE #: 1:20−cv−03010−APM\n\n  UNITED STATES OF AMERICA et al v. GOOGLE LLC        Date Filed: 10/20/2020\n  Assigned "}],"referredTo":null,"referred_to_id":null,"suitNature":"1410 Antitrust","trustee_str":null},{"assignedTo":"Aileen M. Cannon","assigned_to_id":null,"attorney":["Travis Richard Walker"],"attorney_id":[11212297],"caseName":"Doe v. Estate of Jeffrey Epstein","case_name_full":"","cause":"18:1962 Racketeering (RICO) Act","chapter":null,"court":"District Court, S.D. Florida","court_citation_string":"S.D. Fla.","court_id":"flsd","dateArgued":null,"dateFiled":"2026-01-22","dateTerminated":null,"docketNumber":"9:26-cv-80078","docket_absolute_url":"/docket/72177563/doe-v-estate-of-jeffrey-epstein/","docket_id":72177563,"firm":["The Law Offices of Travis R Walker PA"],"firm_id":[1056675],"jurisdictionType":"Federal Question","juryDemand":"Plaintiff","meta":{"timestamp":"2026-01-26T15:36:26.083212Z","date_created":"2026-01-22T21:16:30.326430Z","score":{"bm25":13445136000000.0},"more_docs":true},"pacer_case_id":"705612","party":["The   Estate of Jeffrey Epstein","LAUREL INC","THE 1953 TRUST","Jane Doe"],"party_id":[17197960,17197961,17197962,17197959],"recap_documents":[{"absolute_url":"/docket/72177563/1/doe-v-estate-of-jeffrey-epstein/","attachment_number":null,"cites":[],"description":"COMPLAINT AND JURY DEMAND against Estate of Jeffrey Epstein, LAUREL INC, THE 1953 TRUST. Filing fees $ 405.00. (No fee paid/No IFP filed) filed by Jane Doe Doe. (Attachments: # 1 Civil Cover Sheet, # 2 Summon(s), # 3 Summon(s), # 4 Summon(s))(Walker, Travis) Modified text on 1/23/2026 (scn). (Entered: 01/22/2026)","docket_entry_id":451225534,"document_number":1,"document_type":"PACER Document","entry_date_filed":"2026-01-22","entry_number":1,"filepath_local":"recap/gov.uscourts.flsd.705612/gov.uscourts.flsd.705612.1.0.pdf","id":466062892,"is_available":true,"meta":{"timestamp":"2026-01-26T16:03:27.827829Z","date_created":"2026-01-22T21:45:49.842001Z"},"pacer_doc_id":"051029365598","page_count":20,"short_description":"Complaint","snippet":"Case 9:26-cv-80078-AMC Document 1 Entered on FLSD Docket 01/22/2026 Page 1 of 20\n\n\n\n\n                       UNITED STATES DISTRICT COURT\n                       SOUTHERN DISTRICT OF FLORIDA\n                           (West Palm Beach Division)\n\n  JANE DOE, an Individual,\n\n               Plaintiff,\n                                                       Case No.:\n               v.\n\n  THE ESTATE OF JEFFREY EPSTEIN,\n  by and through its co-executors\n  DARREN K. INDYKE and RICHARD D. KAHN,\n  in their "},{"absolute_url":"/docket/72177563/1/1/doe-v-estate-of-jeffrey-epstein/","attachment_number":1,"cites":[],"description":"COMPLAINT AND JURY DEMAND against Estate of Jeffrey Epstein, LAUREL INC, THE 1953 TRUST. Filing fees $ 405.00. (No fee paid/No IFP filed) filed by Jane Doe Doe. (Attachments: # 1 Civil Cover Sheet, # 2 Summon(s), # 3 Summon(s), # 4 Summon(s))(Walker, Travis) Modified text on 1/23/2026 (scn). (Entered: 01/22/2026)","docket_entry_id":451225534,"document_number":1,"document_type":"Attachment","entry_date_filed":"2026-01-22","entry_number":1,"filepath_local":null,"id":466164299,"is_available":false,"meta":{"timestamp":"2026-01-26T16:03:27.831732Z","date_created":"2026-01-23T17:15:16.546139Z"},"pacer_doc_id":"051029365599","page_count":1,"short_description":"Civil Cover Sheet","snippet":""},{"absolute_url":"/docket/72177563/1/3/doe-v-estate-of-jeffrey-epstein/","attachment_number":3,"cites":[],"description":"COMPLAINT AND JURY DEMAND against Estate of Jeffrey Epstein, LAUREL INC, THE 1953 TRUST. Filing fees $ 405.00. (No fee paid/No IFP filed) filed by Jane Doe Doe. (Attachments: # 1 Civil Cover Sheet, # 2 Summon(s), # 3 Summon(s), # 4 Summon(s))(Walker, Travis) Modified text on 1/23/2026 (scn). (Entered: 01/22/2026)","docket_entry_id":451225534,"document_number":1,"document_type":"Attachment","entry_date_filed":"2026-01-22","entry_number":1,"filepath_local":null,"id":466164301,"is_available":false,"meta":{"timestamp":"2026-01-26T16:03:27.922213Z","date_created":"2026-01-23T17:15:16.760691Z"},"pacer_doc_id":"051029365601","page_count":2,"short_description":"Summon(s)","snippet":""}],"referredTo":null,"referred_to_id":null,"suitNature":"360 P.I.: Other","trustee_str":null},{"assignedTo":"Michelle Vonsenden Larson","assigned_to_id":14444,"attorney":["Mark S. Rubin"],"attorney_id":[11266614],"caseName":"Kevin Alfred Roux","case_name_full":"","cause":"","chapter":"7","court":"United States Bankruptcy Court, N.D. Texas","court_citation_string":"Bankr. N.D. Tex.","court_id":"txnb","dateArgued":null,"dateFiled":"2026-01-22","dateTerminated":null,"docketNumber":"26-30301","docket_absolute_url":"/docket/72175039/kevin-alfred-roux/","docket_id":72175039,"firm":["Rubin & Associates PC"],"firm_id":[984618],"jurisdictionType":"","juryDemand":"","meta":{"timestamp":"2026-02-11T15:18:34.966915Z","date_created":"2026-01-22T17:04:57.614697Z","score":{"bm25":13445136000000.0},"more_docs":false},"pacer_case_id":"537915","party":["United States Trustee","Kevin Alfred Roux","Jeffrey H. Mims"],"party_id":[17305028,17305029,17305030],"recap_documents":[{"absolute_url":"/docket/72175039/1/kevin-alfred-roux/","attachment_number":null,"cites":[],"description":"Individual Chapter 7 voluntary petition. Fee Amount $338 Filed by Kevin Alfred Roux (Rubin, Mark)","docket_entry_id":451147204,"document_number":1,"document_type":"PACER Document","entry_date_filed":"2026-01-22","entry_number":1,"filepath_local":"recap/gov.uscourts.txnb.537915/gov.uscourts.txnb.537915.1.0.pdf","id":465983645,"is_available":true,"meta":{"timestamp":"2026-02-11T15:22:20.721089Z","date_created":"2026-01-22T17:04:58.178098Z"},"pacer_doc_id":"176051620178","page_count":64,"short_description":"Voluntary petition chapter 7 (attorney filer)","snippet":"              Case 26-30301-mvl7                   Doc 1         Filed 01/22/26 Entered 01/22/26 10:57:51                                Desc Main\n                                                                Document      Page 1 of 64\n\nFill in this information to identify your case:\n\nUnited States Bankruptcy Court for the:\n\nNORTHERN DISTRICT OF TEXAS\n\nCase number (if known)                                                        Chapter you are filing under:\n\n                                  "}],"referredTo":null,"referred_to_id":null,"suitNature":"","trustee_str":"Mims, Jeffrey H."},{"assignedTo":"R. Austin Huffaker, Jr","assigned_to_id":null,"attorney":["Gregory Kelly","Annette B. Kelly"],"attorney_id":[11185233,11185234],"caseName":"Kelly v. Alabama Department of Veterans Affairs","case_name_full":"","cause":"28:1983 Civil Rights","chapter":null,"court":"District Court, M.D. Alabama","court_citation_string":"M.D. Ala.","court_id":"almd","dateArgued":null,"dateFiled":"2026-01-16","dateTerminated":"2026-01-20","docketNumber":"2:26-cv-00037","docket_absolute_url":"/docket/72155625/kelly-v-alabama-department-of-veterans-affairs/","docket_id":72155625,"firm":["Gregory Kelly","Annette B. Kelly"],"firm_id":[1056957,955071],"jurisdictionType":"Federal Question","juryDemand":"None","meta":{"timestamp":"2026-01-20T21:01:17.328220Z","date_created":"2026-01-16T21:26:45.313694Z","score":{"bm25":13444617000000.0},"more_docs":false},"pacer_case_id":"89443","party":["Laury B. Morgan","Kent Davis","Kay Ivey","Alabama State Personnel Board","State Military Department","Alabama Department of Veterans Affairs","State of Alabama Gov. Office","David K. Pritchett","Alabama State Personnel Department","Jeffrey Newton","Sheryle E. Gordon","Gregory Kelly","Annette B. Kelly"],"party_id":[17153378,17153379,17153380,17153381,17153382,17153383,17153384,17153385,17153386,17153387,17153388,17153389,17153390],"recap_documents":[{"absolute_url":"/docket/72155625/1/kelly-v-alabama-department-of-veterans-affairs/","attachment_number":null,"cites":[],"description":"COMPLAINT against Alabama Department of Veterans Affairs, Alabama State Personnel Board, Alabama State Personnel Department, Kent Davis, Sheryle E. Gordon, Kay Ivey, Laury B. Morgan, Jeffrey Newton, David K. Pritchett, State Military Department, State of Alabama Gov. Office (Filing fee $ 405, Receipt Number 9782.), filed by Annette B. Kelly, Gregory Kelly. 90 day Rule 4m deadline set for 4/16/2026. (Attachments: # 1 Exhibit 1, # 2 Exhibit 2, # 3 Exhibit 3, # 4 Exhibit 4, # 5 Exhibit 5, # 6 Exhibit 6, # 7 Exhibit 7, # 8 Exhibit 8, # 9 Exhibit 9, # 10 Exhibit 10, # 11 Exhibit 11, # 12 Exhibit 12, # 13 Proposed Summons, # 14 Receipt)(HRR) (Entered: 01/16/2026)","docket_entry_id":450656023,"document_number":1,"document_type":"PACER Document","entry_date_filed":"2026-01-16","entry_number":1,"filepath_local":"recap/gov.uscourts.almd.89443/gov.uscourts.almd.89443.1.0.pdf","id":465478186,"is_available":true,"meta":{"timestamp":"2026-01-20T21:01:17.319782Z","date_created":"2026-01-16T23:20:41.115720Z"},"pacer_doc_id":"01704590287","page_count":28,"short_description":"Complaint","snippet":"     Case 2:26-cv-00037-RAH-KFP   Document 1    Filed 01/16/26   Page 1 of 28\n\n\n\n\n                IN THE UNITED STATES DISTRICT COURT\n                FOR THE MIDDLE DISTRICT OF AI;Uf~ / ~ j'-.\n                         NORTHERN DIVISION\n                                            ZUlb J I I 6 1p 3: I I\n\n\nGREGORY KELLY AND\nANNETTE B. KELLY\n6213 Willow Glen Dr\nMontgomery ,AL 3611 7                          2:26-cv-37-RAH-KFP\nPlaintiffs,\n\nvs                                                           "}],"referredTo":"Kelly Fitzgerald Pate","referred_to_id":14479,"suitNature":"440 Civil Rights: Other","trustee_str":null},{"assignedTo":"Royce C. Lamberth","assigned_to_id":1844,"attorney":["Adam Alexander Marshall"],"attorney_id":[11176580],"caseName":"CENTER FOR INVESTIGATIVE REPORTING v. FEDERAL BUREAU OF PRISONS","case_name_full":"","cause":"05:552 Freedom of Information Act","chapter":null,"court":"District Court, District of Columbia","court_citation_string":"D.D.C.","court_id":"dcd","dateArgued":null,"dateFiled":"2026-01-14","dateTerminated":null,"docketNumber":"1:26-cv-00104","docket_absolute_url":"/docket/72143409/center-for-investigative-reporting-v-federal-bureau-of-prisons/","docket_id":72143409,"firm":["Reporters Committee for Freedom of the Press"],"firm_id":[360383],"jurisdictionType":"U.S. Government Defendant","juryDemand":"None","meta":{"timestamp":"2026-01-16T15:46:09.508930Z","date_created":"2026-01-14T19:23:47.580664Z","score":{"bm25":13444445000000.0},"more_docs":false},"pacer_case_id":"288440","party":["CENTER FOR INVESTIGATIVE REPORTING","FEDERAL BUREAU OF PRISONS"],"party_id":[17135556,17135557],"recap_documents":[{"absolute_url":"/docket/72143409/1/center-for-investigative-reporting-v-federal-bureau-of-prisons/","attachment_number":null,"cites":[],"description":"COMPLAINT against FEDERAL BUREAU OF PRISONS ( Filing fee $ 405 receipt number ADCDC-12185692) filed by CENTER FOR INVESTIGATIVE REPORTING. (Attachments: # 1 Exhibit 1, # 2 Exhibit 2, # 3 Exhibit 3, # 4 Civil Cover Sheet, # 5 Summons)(Marshall, Adam) (Entered: 01/14/2026)","docket_entry_id":450308294,"document_number":1,"document_type":"PACER Document","entry_date_filed":"2026-01-14","entry_number":1,"filepath_local":"recap/gov.uscourts.dcd.288440/gov.uscourts.dcd.288440.1.0.pdf","id":465122697,"is_available":true,"meta":{"timestamp":"2026-01-16T15:46:32.138723Z","date_created":"2026-01-14T19:23:48.469420Z"},"pacer_doc_id":"045011851001","page_count":7,"short_description":"Complaint","snippet":"       Case 1:26-cv-00104-RCL       Document 1     Filed 01/14/26   Page 1 of 7\n\n\n\n\n                     IN THE UNITED STATES DISTRICT COURT\n                         FOR THE DISTRICT OF COLUMBIA\n\n\n\nCENTER FOR INVESTIGATIVE\nREPORTING\nPO Box 584\nSan Francisco, CA 94104\n\n                     Plaintiff,\n\n       v.                                          Civil Action No. ______________\n\nFEDERAL BUREAU OF PRISONS\n320 First Street, NW\nWashington, DC 20534\n\n                     Defendant.\n\n\n      COMPL"}],"referredTo":null,"referred_to_id":null,"suitNature":"895 Freedom of Information Act","trustee_str":null},{"assignedTo":"Martin Karl Reidinger","assigned_to_id":2692,"attorney":[],"attorney_id":[],"caseName":"Presidential Candidate Number P60005535 v. Cherniavska","case_name_full":"","cause":"28:1332 Diversity-Declaratory Judgment","chapter":null,"court":"District Court, W.D. North Carolina","court_citation_string":"W.D.N.C.","court_id":"ncwd","dateArgued":null,"dateFiled":"2026-01-12","dateTerminated":null,"docketNumber":"1:26-cv-00015","docket_absolute_url":"/docket/72131576/presidential-candidate-number-p60005535-v-cherniavska/","docket_id":72131576,"firm":[],"firm_id":[],"jurisdictionType":"","juryDemand":"","meta":{"timestamp":"2026-02-10T09:40:20.056761Z","date_created":"2026-01-12T18:37:20.512979Z","score":{"bm25":13444272000000.0},"more_docs":false},"pacer_case_id":"122377","party":["Presidential Candidate Number P60005535","Cherniavska"],"party_id":[],"recap_documents":[{"absolute_url":"/docket/72131576/1/presidential-candidate-number-p60005535-v-cherniavska/","attachment_number":null,"cites":[],"description":"","docket_entry_id":450022497,"document_number":1,"document_type":"PACER Document","entry_date_filed":"2026-01-12","entry_number":1,"filepath_local":"recap/gov.uscourts.ncwd.122377/gov.uscourts.ncwd.122377.1.0.pdf","id":464830051,"is_available":true,"meta":{"timestamp":"2026-02-10T09:40:20.043213Z","date_created":"2026-01-12T19:17:08.788938Z"},"pacer_doc_id":"13505747117","page_count":12,"short_description":"Complaint","snippet":"IN THE UNITED STATES DISTRICT COURT FOR THE\nWESTERN DISTRICT OF NORTH CAROLINA\n(United States Courthouse, 100 Otis Street, Room 309, Asheville, NC\n\n28801)\nve FILED\n) w.. ASHEVILLE, NC\n) JAN 42 2026\nPresidential Candidate Number P60005535 ) U.S. DISTRICT COURT\n“also known as” (aka) Ronald Satish Emrit, ) W. DISTRICT OF N.C,\n& Presidential Committee/Political Action )\n\nCommittee/Separate Segregated Fund (SSF) )\n\nNumber C00569897 d/b/a United )\nEmrits of America )\nPlaintiffs (Pro Se) )\n) C. A. No.:"}],"referredTo":"William C. Metcalf","referred_to_id":9365,"suitNature":"P.I.: Other","trustee_str":null},{"assignedTo":"Stephanie Marie Rose","assigned_to_id":2771,"attorney":["Becky S. Knutson","Eric H. Wessan","Christy Ann Aumer Hickman","Lindsey Browning","Katie Schoolen"],"attorney_id":[11187885,11187886,11187887,11187888,11187889],"caseName":"Mejia v. Iowa Board of Educational Examiners","case_name_full":"","cause":"42:1983dp Civil Right Denial of Due Process","chapter":null,"court":"District Court, S.D. Iowa","court_citation_string":"S.D. Iowa","court_id":"iasd","dateArgued":null,"dateFiled":"2026-01-09","dateTerminated":null,"docketNumber":"4:26-cv-00020","docket_absolute_url":"/docket/72127870/mejia-v-iowa-board-of-educational-examiners/","docket_id":72127870,"firm":["Iowa State Education Association","Iowa Department of Justice, Office of the Attorney General"],"firm_id":[313220,897319],"jurisdictionType":"Federal Question","juryDemand":"None","meta":{"timestamp":"2026-02-05T19:01:10.232225Z","date_created":"2026-01-09T23:20:28.361973Z","score":{"bm25":13444013000000.0},"more_docs":false},"pacer_case_id":"93255","party":["Jennifer Smith","Katherine Mejia","Iowa Board of Educational Examiners"],"party_id":[17157412,17157413,17157414],"recap_documents":[{"absolute_url":"/docket/72127870/2/1/mejia-v-iowa-board-of-educational-examiners/","attachment_number":1,"cites":[758061,774643,1196087,1263994,4288403,4637719,9423736,9424427,9426519,9429164,9431098,9433210,9434945,9435422,9467531,10793421],"description":"MOTION for Preliminary Injunction by Katherine Mejia, Jennifer Smith. Responses due by 1/23/2026. (Attachments: # 1 Brief in Support Plaintiffs' Brief in Support of TRO)(Knutson, Becky) (Entered: 01/09/2026)","docket_entry_id":449879912,"document_number":2,"document_type":"Attachment","entry_date_filed":"2026-01-09","entry_number":2,"filepath_local":"recap/gov.uscourts.iasd.93255/gov.uscourts.iasd.93255.2.1.pdf","id":465586078,"is_available":true,"meta":{"timestamp":"2026-02-05T19:01:10.198494Z","date_created":"2026-01-19T19:04:28.869054Z"},"pacer_doc_id":"07704417775","page_count":18,"short_description":"Brief in Support Plaintiffs' Brief in Support of TRO","snippet":"    Case 4:26-cv-00020-SMR-HCA                                Document 2-1                 Filed 01/09/26               Page 1 of 18\n\n\n\n\n                                    IN THE UNITED STATES DISTRICT COURT\n                                     FOR THE SOUTHERN DISTRICT OF IOWA\n                                              CENTRAL DIVISION\n\n\n KATHERINE MEJIA and JENNIFER SMITH,\n                                                                                              NO. _______________\n    "}],"referredTo":"Helen C. Adams","referred_to_id":9213,"suitNature":"442 Civil Rights: Jobs","trustee_str":null},{"assignedTo":"Sharon Louise Gleason","assigned_to_id":1215,"attorney":["Ronald Satish Emrit"],"attorney_id":[11161475],"caseName":"Emrit v. Snoop Doggy Dogg","case_name_full":"","cause":"No cause code entered","chapter":null,"court":"District Court, D. Alaska","court_citation_string":"D. Alaska","court_id":"akd","dateArgued":null,"dateFiled":"2026-01-07","dateTerminated":null,"docketNumber":"3:26-cv-00007","docket_absolute_url":"/docket/72120087/emrit-v-snoop-doggy-dogg/","docket_id":72120087,"firm":["Ronald Satish Emrit"],"firm_id":[231512],"jurisdictionType":"Diversity","juryDemand":"Plaintiff","meta":{"timestamp":"2026-01-13T20:21:42.015020Z","date_created":"2026-01-08T19:45:44.938406Z","score":{"bm25":13443840000000.0},"more_docs":false},"pacer_case_id":"77866","party":["Roger Goodell","The Racist State of Arizona","NBC","Estate of Eazy E Eric Wright","Snoop Doggy Dogg","Vivendi Universal","Dr. Dre","United States Olympic Committee (USOC)","NBC Universal","Comcast","Mike Tirico","Ice Cube","Jay-Z","Super Bowl Halftime Show","Kendrick Lamar","Peacock","Snoop Doggy Dogg Bowl in Arizona","National Football League (NFL)","Sunday Night Football","Cris Collinsworth","Bad Bunny","Ronald Satish Emrit"],"party_id":[17106741,17106744,17106745,17106746,17106747,17106748,17106749,17106750,17106751,17106752,17106753,17106754,17106755,17106756,17106757,17106758,17106759,17106760,17106761,17106762,17106763,17129674],"recap_documents":[{"absolute_url":"/docket/72120087/1/emrit-v-snoop-dogg-dogg/","attachment_number":null,"cites":[],"description":"COMPLAINT against All Defendants, filed by Ronald Satish Emrit. (Attachments: # 1 Exhibit A, # 2 Exhibit B, # 3 Exhibit C, # 4 Exhibit D, # 5 Exhibit E)(PXS, COURT STAFF) (Entered: 01/08/2026)","docket_entry_id":449692400,"document_number":1,"document_type":"PACER Document","entry_date_filed":"2026-01-07","entry_number":1,"filepath_local":"recap/gov.uscourts.akd.77866/gov.uscourts.akd.77866.1.0.pdf","id":464492270,"is_available":true,"meta":{"timestamp":"2026-01-13T20:29:58.021174Z","date_created":"2026-01-08T20:13:16.425180Z"},"pacer_doc_id":"02303095970","page_count":16,"short_description":"Complaint","snippet":"           IN THE UNITED STATES DISTRICT COURT FOR THE\n                           DISTRICT OF ALASKA\n\n   (U.S. District Court, 222 W. 7th Avenue, Room 229, Box/Suite #4,\n\n\n\n                                            )\n                                                 )\nSatish Dat Beast (Former Client of               )\n                                                                     u«a\n\n\n“Larry Birkhead Attorney” Nancy Hass        )\nof Hallandale Beach, Florida as Family Law   )\n           "}],"referredTo":null,"referred_to_id":null,"suitNature":"360 P.I.: Other","trustee_str":null},{"assignedTo":"Lewis Jeffrey Liman","assigned_to_id":14461,"attorney":["Eunon Jason Mizrahi","Joseph Michael Bonomo","Stephen McQuade","Joshua Levin-Epstein"],"attorney_id":[11159730,11229763,11229764,11225922],"caseName":"Castro v. Omta Tech Inc.","case_name_full":"","cause":"15:2(a) Fair Labor Standards Act","chapter":null,"court":"District Court, S.D. New York","court_citation_string":"S.D.N.Y.","court_id":"nysd","dateArgued":null,"dateFiled":"2026-01-07","dateTerminated":null,"docketNumber":"1:26-cv-00133","docket_absolute_url":"/docket/72116553/castro-v-omta-tech-inc/","docket_id":72116553,"firm":["Levin-Epstein & Associates, P.C.","Pitta LLP"],"firm_id":[362632,676343],"jurisdictionType":"Federal Question","juryDemand":"Plaintiff","meta":{"timestamp":"2026-01-29T15:54:13.966755Z","date_created":"2026-01-07T22:56:36.635362Z","score":{"bm25":13443840000000.0},"more_docs":false},"pacer_case_id":"655818","party":["Omta Tech Inc.","Bernabe Coxolca","Jesey Estrada","Sahim Last Name Unknown","Ilham Ozgan","Kenneth Castro","Omer Tale"],"party_id":[17221632,17221633,17221634,17221635,17228343,17228344,17104028],"recap_documents":[{"absolute_url":"/docket/72116553/16/castro-v-omta-tech-inc/","attachment_number":null,"cites":[],"description":"NOTICE OF APPEARANCE by Joshua Levin-Epstein on behalf of Omer Tale, Omta Tech Inc...(Levin-Epstein, Joshua) (Entered: 01/29/2026)","docket_entry_id":452007160,"document_number":16,"document_type":"PACER Document","entry_date_filed":"2026-01-29","entry_number":16,"filepath_local":null,"id":466865534,"is_available":false,"meta":{"timestamp":"2026-01-30T17:04:41.861186Z","date_created":"2026-01-29T17:12:19.303361Z"},"pacer_doc_id":"127038972298","page_count":null,"short_description":"Notice of Appearance","snippet":""}],"referredTo":null,"referred_to_id":null,"suitNature":"710 Labor: Fair Standards","trustee_str":null},{"assignedTo":"Lawrence Joseph Vilardo","assigned_to_id":8645,"attorney":[],"attorney_id":[],"caseName":"Presidential Candidate Number P60005535 v. Cherniavska","case_name_full":"","cause":"","chapter":null,"court":"District Court, W.D. New York","court_citation_string":"W.D.N.Y.","court_id":"nywd","dateArgued":null,"dateFiled":"2026-01-06","dateTerminated":null,"docketNumber":"1:26-cv-00009","docket_absolute_url":"/docket/72109198/presidential-candidate-number-p60005535-v-cherniavska/","docket_id":72109198,"firm":[],"firm_id":[],"jurisdictionType":"","juryDemand":"","meta":{"timestamp":"2026-01-06T19:38:00.452126Z","date_created":"2026-01-06T18:37:57.351136Z","score":{"bm25":13443754000000.0},"more_docs":false},"pacer_case_id":"159561","party":["Presidential Candidate Number P60005535","Cherniavska"],"party_id":[],"recap_documents":[{"absolute_url":"/docket/72109198/1/presidential-candidate-number-p60005535-v-cherniavska/","attachment_number":null,"cites":[],"description":"","docket_entry_id":449469074,"document_number":1,"document_type":"PACER Document","entry_date_filed":"2026-01-06","entry_number":1,"filepath_local":"recap/gov.uscourts.nywd.159561/gov.uscourts.nywd.159561.1.0.pdf","id":464263792,"is_available":true,"meta":{"timestamp":"2026-01-07T11:30:48.682867Z","date_created":"2026-01-07T11:30:22.225220Z"},"pacer_doc_id":"12906880020","page_count":14,"short_description":"Complaint","snippet":"Case 1:26-cv-00009-LJV Document1 Filed 01/06/26 Page1of14\n\nIN THE UNITED STATES DISTRICT COURT FOR THE\nWESTERN DISTRICT OF NEW YORK\n(100 State Street, Rochester, NY 14614)\n\n)\n\n)\nPresidential Candidate Number P60005535 )\n“also known as” (aka) Ronald Satish Emrit, )\n& Presidential Committee/Political Action )\nCommittee/Separate Segregated Fund (SSF) )\nNumber C00569897 d/b/a United )\n\nEmrits of America )\nPlaintiffs (Pro Se) ) _\n) CA.No: 26-cv- Y LV\nVv. )\n\n)\nMaria Cherniavska of Warsaw, Poland (Futu"}],"referredTo":null,"referred_to_id":null,"suitNature":"","trustee_str":null},{"assignedTo":null,"assigned_to_id":null,"attorney":[],"attorney_id":[],"caseName":"In re: Charles Johnson","case_name_full":"","cause":"","chapter":null,"court":"Court of Appeals for the Fifth Circuit","court_citation_string":"5th Cir.","court_id":"ca5","dateArgued":null,"dateFiled":"2025-12-30","dateTerminated":"2026-01-08","docketNumber":"25-11393","docket_absolute_url":"/docket/72111883/in-re-charles-johnson/","docket_id":72111883,"firm":[],"firm_id":[],"jurisdictionType":"","juryDemand":"","meta":{"timestamp":"2026-01-08T16:57:05.038542Z","date_created":"2026-01-07T03:09:38.942761Z","score":{"bm25":13443149000000.0},"more_docs":true},"pacer_case_id":"228019","party":[],"party_id":[],"recap_documents":[{"absolute_url":"/docket/72111883/18/2/in-re-charles-johnson/","attachment_number":2,"cites":[],"description":"APPENDIX FILED [25-11393]REVIEWED AND/OR EDITED - The original text prior to review appeared as follows: APPENDIX FILED by Respondents Mr. Hal Lambert and Point Bridge Capital, L.L.C. Date of Service: 01/06/2026 via email - Attorney for Respondent: Thompson; Attorney for Petitioners: Turner, Wynne [25-11393] (William Bennett Thompson ) [Entered: 01/06/2026 04:33 PM]","docket_entry_id":449458071,"document_number":18,"document_type":"Attachment","entry_date_filed":"2026-01-06","entry_number":18,"filepath_local":"recap/gov.uscourts.ca5.228019/gov.uscourts.ca5.228019.18.2.pdf","id":464251651,"is_available":true,"meta":{"timestamp":"2026-01-11T04:56:03.562000Z","date_created":"2026-01-07T03:10:19.914965Z"},"pacer_doc_id":"00507822565","page_count":93,"short_description":"Exhibits in Support (Appx.2033-2125)","snippet":"             Case: 25-11393 Document: 18-2 Page: 1 Date Filed: 01/06/2026\n   Case 4:24-cv-00988-P Document 116-1 Filed 10/28/25 Page 27 of 114 PageID 2984\n\nThompson, Will\n\nFrom:                          Arthur Bloom <arthuriana89@gmail.com>\nSent:                          Tuesday, September 23, 2025 7:08 PM\nTo:                            Thompson, Will\nSubject:                       Demand for retraction\n\n\n\n\n\nEXTERNAL MESSAGE\n\nDear Mr. Thompson,\nI am told you called me a \"vile anti-semite\" in "},{"absolute_url":"/docket/72111883/15/in-re-charles-johnson/","attachment_number":null,"cites":[9569,21090,22013,32187,33918,36540,69241,69606,104630,110227,153405,187288,215126,269913,481012,537210,652931,2022997,2790651,4402817,4440972,4448112,4448740,4504130,4708035,8927704,8966023,9413182,9423484,9429766,9431256,9434668,9691736,9808641,9889176],"description":"RESPONSE/OPPOSITION [15] to the Court Order Court directive requesting a response [12]Response/Opposition deadline satisfied. [25-11393]REVIEWED AND/OR EDITED - The original text prior to review appeared as follows: RESPONSE/OPPOSITION filed by Mr. Hal Lambert and Point Bridge Capital, L.L.C. [15] to the Petition for writ of mandamus filed by Petitioner Mr. Charles Johnson [2] Date of Service: 01/06/2026 via email - Attorney for Respondent: Thompson; Attorney for Petitioners: Turner, Wynne. [25-11393] (William Bennett Thompson ) [Entered: 01/06/2026 04:22 PM]","docket_entry_id":449458068,"document_number":15,"document_type":"PACER Document","entry_date_filed":"2026-01-06","entry_number":15,"filepath_local":"recap/gov.uscourts.ca5.228019/gov.uscourts.ca5.228019.15.0.pdf","id":464251643,"is_available":true,"meta":{"timestamp":"2026-01-08T16:57:05.010976Z","date_created":"2026-01-07T03:09:40.250837Z"},"pacer_doc_id":"00507822524","page_count":50,"short_description":"","snippet":" Case: 25-11393    Document: 15        Page: 1        Date Filed: 01/06/2026\n\n\n\n\n                          No. 25-11393\n\n\nIn the United States Court of Appeals\n        for the Fifth Circuit\n                       ____________________________\n\n\n\n\n                  IN RE: CHARLES JOHNSON\n\n\n                       ————————\n\n            On Petition for a Writ of Mandamus\n\n                       ————————\nRESPONSE TO PETITION FOR WRIT OF MANDAMUS\n                       ————————\n\n                       "},{"absolute_url":"/docket/72111883/16/1/in-re-charles-johnson/","attachment_number":1,"cites":[16728,19022,24446,29553,30586,35986,59426,98551,104200,109903,206601,615686,766377,802818,815610,869774,1028403,1410540,1414340,1504000,1584299,2406535,2476713,2654100,2654532,2669619,3179005,4242320,4242321,4511954,4671322,5127845,5140257,5283917,7244198,7253663,7801528,8409778,8747132,8772056,8899859,9320665,9415230,9430020,9432551,9434359,9435068,9435339,9464752,9498686],"description":"APPENDIX FILED [25-11393]REVIEWED AND/OR EDITED - The original text prior to review appeared as follows: APPENDIX FILED by Respondents Mr. Hal Lambert and Point Bridge Capital, L.L.C. Date of Service: 01/06/2026 via email - Attorney for Respondent: Thompson; Attorney for Petitioners: Turner, Wynne [25-11393] (William Bennett Thompson ) [Entered: 01/06/2026 04:27 PM]","docket_entry_id":449458069,"document_number":16,"document_type":"Attachment","entry_date_filed":"2026-01-06","entry_number":16,"filepath_local":"recap/gov.uscourts.ca5.228019/gov.uscourts.ca5.228019.16.1.pdf","id":464251644,"is_available":true,"meta":{"timestamp":"2026-01-11T05:04:49.617803Z","date_created":"2026-01-07T03:09:40.323102Z"},"pacer_doc_id":"00507822543","page_count":390,"short_description":"Exhibits in Support (Appx.001-390)","snippet":"Case: 25-11393   Document: 16-1   Page: 1   Date Filed: 01/06/2026\n\n\n\n\n     EXHIBIT 1\n\n\n\n\n                                                                     App.001\n\f      Case: 25-11393       Document: 16-1 Page: 2 Date Filed: 01/06/2026\nCase 4:24-cv-00988-P      Document 18 Filed 12/16/24 Page 1 of 2 PageID 222\n\n\n\n                  UNITED STATES DISTRICT COURT\n               FOR THE NORTHERN DISTRICT OF TEXAS\n                      FORT WORTH DIVISION\n\n      POINT BRIDGE CAPITAL, LLC,\n      E"}],"referredTo":null,"referred_to_id":null,"suitNature":"","trustee_str":null},{"assignedTo":"Mary Kay Vyskocil","assigned_to_id":null,"attorney":["Caryn Gail Schechtman"],"attorney_id":[11098736],"caseName":"Wolff v. Trump","case_name_full":"","cause":"28:1332 Diversity Action","chapter":null,"court":"District Court, S.D. New York","court_citation_string":"S.D.N.Y.","court_id":"nysd","dateArgued":null,"dateFiled":"2025-12-29","dateTerminated":null,"docketNumber":"1:25-cv-10752","docket_absolute_url":"/docket/72085702/wolff-v-trump/","docket_id":72085702,"firm":["Dla Piper US LLP (Ny)"],"firm_id":[273943],"jurisdictionType":"Diversity","juryDemand":"None","meta":{"timestamp":"2025-12-30T19:17:02.151696Z","date_created":"2025-12-29T22:21:06.038689Z","score":{"bm25":13443062000000.0},"more_docs":false},"pacer_case_id":"655484","party":["Melania Trump","Michael Wolff"],"party_id":[17029833,17029834],"recap_documents":[{"absolute_url":"/docket/72085702/1/wolff-v-trump/","attachment_number":null,"cites":[109703,302289,4426238,6939681,9433788],"description":"NOTICE OF REMOVAL from Supreme Court, County of New York. Case Number: 163900/2025. (Filing Fee $ 405.00, Receipt Number ANYSDC-32191437).Document filed by Melania Trump. (Attachments: # 1 Exhibit 1 Summons and Complaint).(Schechtman, Caryn) (Entered: 12/29/2025)","docket_entry_id":448705591,"document_number":1,"document_type":"PACER Document","entry_date_filed":"2025-12-29","entry_number":1,"filepath_local":"recap/gov.uscourts.nysd.655484/gov.uscourts.nysd.655484.1.0.pdf","id":463483662,"is_available":true,"meta":{"timestamp":"2025-12-30T20:00:23.433319Z","date_created":"2025-12-30T01:09:14.711955Z"},"pacer_doc_id":"127038802226","page_count":8,"short_description":"Notice of Removal","snippet":"        Case 1:25-cv-10752-MKV           Document 1       Filed 12/29/25      Page 1 of 8\n\n\n\n\nUNITED STATES DISTRICT COURT\nSOUTHERN DISTRICT OF NEW YORK\n---------------------------------------- x\n                                         :\nMICHAEL WOLFF,                           :\n                                         :\n                        Plaintiff,       :\n                                         :\n      -against-                          :                 Case No. 25 Civ. 10752\n       "},{"absolute_url":"/docket/72085702/1/1/wolff-v-trump/","attachment_number":1,"cites":[744062,820615,1804268,1840527,2572544,2744023,5684037,9037673,9326446,9432089,10732911],"description":"NOTICE OF REMOVAL from Supreme Court, County of New York. Case Number: 163900/2025. (Filing Fee $ 405.00, Receipt Number ANYSDC-32191437).Document filed by Melania Trump. (Attachments: # 1 Exhibit 1 Summons and Complaint).(Schechtman, Caryn) (Entered: 12/29/2025)","docket_entry_id":448705591,"document_number":1,"document_type":"Attachment","entry_date_filed":"2025-12-29","entry_number":1,"filepath_local":"recap/gov.uscourts.nysd.655484/gov.uscourts.nysd.655484.1.1.pdf","id":463585919,"is_available":true,"meta":{"timestamp":"2025-12-30T19:59:45.846121Z","date_created":"2025-12-30T19:16:43.047262Z"},"pacer_doc_id":"127038802227","page_count":23,"short_description":"Exhibit 1 Summons and Complaint","snippet":"Case 1:25-cv-10752-MKV   Document 1-1   Filed 12/29/25   Page 1 of 23\n\n\n\n\n                  Exhibit 1\n\fFILED: NEW YORK COUNTY CLERK 10/21/2025 06:27 PM                                                                        INDEX NO. 163900/2025\nNYSCEF DOC. NO. Case\n                 1   1:25-cv-10752-MKV                       Document 1-1              Filed 12/29/25          Page 2 ofNYSCEF:\n                                                                                                          "}],"referredTo":null,"referred_to_id":null,"suitNature":"320 Assault Libel & Slander","trustee_str":null},{"assignedTo":null,"assigned_to_id":null,"attorney":[],"attorney_id":[],"caseName":"Jane Doe I.P., as next friend of minor Jane Doe I.D. v. Roblox Corporation","case_name_full":"","cause":"","chapter":null,"court":"District Court, N.D. California","court_citation_string":"N.D. Cal.","court_id":"cand","dateArgued":null,"dateFiled":"2025-12-23","dateTerminated":null,"docketNumber":"3:25-cv-10948","docket_absolute_url":"/docket/72076662/jane-doe-ip-as-next-friend-of-minor-jane-doe-id-v-roblox-corporation/","docket_id":72076662,"firm":[],"firm_id":[],"jurisdictionType":"","juryDemand":"","meta":{"timestamp":"2025-12-24T23:33:59.234256Z","date_created":"2025-12-23T23:02:03.348922Z","score":{"bm25":13442544000000.0},"more_docs":false},"pacer_case_id":"461748","party":["Jane Doe I.P., as next friend of minor Jane Doe I.D.","Roblox Corporation"],"party_id":[],"recap_documents":[{"absolute_url":"/docket/72076662/1/jane-doe-ip-as-next-friend-of-minor-jane-doe-id-v-roblox-corporation/","attachment_number":null,"cites":[],"description":"","docket_entry_id":448226341,"document_number":1,"document_type":"PACER Document","entry_date_filed":"2025-12-23","entry_number":1,"filepath_local":"recap/gov.uscourts.cand.461748/gov.uscourts.cand.461748.1.0.pdf","id":462995732,"is_available":true,"meta":{"timestamp":"2025-12-29T07:04:37.602067Z","date_created":"2025-12-23T23:02:03.453213Z"},"pacer_doc_id":"035026580714","page_count":36,"short_description":"Complaint","snippet":"           Case 3:25-cv-10948-RS         Document 1      Filed 12/23/25     Page 1 of 36\n\n\n\n\n 1   Caleb Marker (SBN 269721)\n       caleb.marker@zimmreed.com\n 2   Jessica M. Liu (SBN 358713)\n       jessica.liu@zimmreed.com\n 3   ZIMMERMAN REED LLP\n     6420 Wilshire Blvd., Suite 1080\n 4   Los Angeles, CA 90048\n     Tel: (877) 500-8780\n 5   Fax: (877) 500-8781\n\n 6   Counsel for Plaintiff\n\n 7   [Additional Counsel Listed on Signature Page]\n\n 8\n 9\n                                  UNITED STATES DISTR"}],"referredTo":null,"referred_to_id":null,"suitNature":"","trustee_str":null},{"assignedTo":"Analisa Nadine Torres","assigned_to_id":3243,"attorney":["Arick W. Fudali"],"attorney_id":[10970129],"caseName":"Jane Doe 1 v. United States","case_name_full":"","cause":"28:1346 U.S. Defendant","chapter":null,"court":"District Court, S.D. New York","court_citation_string":"S.D.N.Y.","court_id":"nysd","dateArgued":null,"dateFiled":"2025-12-19","dateTerminated":null,"docketNumber":"1:25-cv-10558","docket_absolute_url":"/docket/72061309/jane-doe-1-v-united-states/","docket_id":72061309,"firm":["The Bloom Firm"],"firm_id":[571676],"jurisdictionType":"Federal Question","juryDemand":"Plaintiff","meta":{"timestamp":"2025-12-19T20:25:16.380121Z","date_created":"2025-12-19T19:40:23.621679Z","score":{"bm25":13442198000000.0},"more_docs":false},"pacer_case_id":"655153","party":["Jane Doe 5","Jane Doe 2","Jane Doe 8","Jane Doe 3","Jane Doe 4","Jane Doe 6","United States of America","Jane Doe 7","Jane Doe 1"],"party_id":[16882615,16882616,16882617,16882618,16882619,16882620,16882621,16882622,16882623],"recap_documents":[{"absolute_url":"/docket/72061309/1/jane-doe-1-v-united-states/","attachment_number":null,"cites":[],"description":"COMPLAINT against United States of America. (Filing Fee $ 405.00, Receipt Number 45536)Document filed by Jane Doe 6, Jane Doe 2, Jane Doe 4, Jane Doe 5, Jane Doe 8, Jane Doe 1, Jane Doe 7, Jane Doe 3.(vf) (Entered: 12/19/2025)","docket_entry_id":447819214,"document_number":1,"document_type":"PACER Document","entry_date_filed":"2025-12-19","entry_number":1,"filepath_local":"recap/gov.uscourts.nysd.655153/gov.uscourts.nysd.655153.1.0.pdf","id":462580426,"is_available":true,"meta":{"timestamp":"2025-12-19T21:14:25.107124Z","date_created":"2025-12-19T20:25:17.189285Z"},"pacer_doc_id":"127038767186","page_count":25,"short_description":"Complaint","snippet":"            Case 1:25-cv-10558-AT               Document 1          Filed 12/19/25         Page 1 of 25\n\n\n\n\n                                  UNITED STATES DISTRICT COURT\n                                 SOUTHERN DISTRICT OF NEW YORK\n\n\n\n                                                               COMPLAINT\nJANE DOE 1, JANE DOE 2, JANE DOE 3,\nJANE DOE 4, JANE DOE 5, JANE DOE 6,                            JURY TRIAL DEMANDED\nJANE DOE 7, and JANE DOE 8\n\n\n\n                                    Plain"}],"referredTo":null,"referred_to_id":null,"suitNature":"360 P.I.: Other","trustee_str":null},{"assignedTo":"Colleen Kollar-Kotelly","assigned_to_id":1810,"attorney":["Stephen Stich Match","Merrick Jason Wayne","Matthew Topic"],"attorney_id":[10967516,10967517,10967518],"caseName":"LEOPOLD v. U.S. DEPARTMENT OF JUSTICE","case_name_full":"","cause":"05:552 Freedom of Information Act","chapter":null,"court":"District Court, District of Columbia","court_citation_string":"D.D.C.","court_id":"dcd","dateArgued":null,"dateFiled":"2025-12-18","dateTerminated":null,"docketNumber":"1:25-cv-04398","docket_absolute_url":"/docket/72053579/leopold-v-us-department-of-justice/","docket_id":72053579,"firm":["Loevy & Loevy"],"firm_id":[831321],"jurisdictionType":"U.S. Government Defendant","juryDemand":"None","meta":{"timestamp":"2025-12-19T21:38:33.101042Z","date_created":"2025-12-18T17:11:07.562124Z","score":{"bm25":13442112000000.0},"more_docs":false},"pacer_case_id":"287838","party":["U.S. DEPARTMENT OF JUSTICE","BLOOMBERG L.P.","JASON LEOPOLD","FEDERAL BUREAU OF PRISONS"],"party_id":[16878481,16878482,16878483,16878484],"recap_documents":[{"absolute_url":"/docket/72053579/1/1/leopold-v-us-department-of-justice/","attachment_number":1,"cites":[],"description":"COMPLAINT against FEDERAL BUREAU OF PRISONS, U.S. DEPARTMENT OF JUSTICE ( Filing fee $ 405 receipt number ADCDC-12144485) filed by JASON LEOPOLD, BLOOMBERG L.P.. (Attachments: # 1 Exhibit 1-2, # 2 Civil Cover Sheet, # 3 Summons)(Topic, Matthew) (Entered: 12/18/2025)","docket_entry_id":447639130,"document_number":1,"document_type":"Attachment","entry_date_filed":"2025-12-18","entry_number":1,"filepath_local":"recap/gov.uscourts.dcd.287838/gov.uscourts.dcd.287838.1.1.pdf","id":462467300,"is_available":true,"meta":{"timestamp":"2025-12-19T21:39:09.050323Z","date_created":"2025-12-18T23:02:35.496786Z"},"pacer_doc_id":"045011807776","page_count":13,"short_description":"Exhibit 1-2","snippet":"Case 1:25-cv-04398-CKK   Document 1-1   Filed 12/18/25   Page 1 of 13\n                                                                        Exhibit 1\n\f                               Case 1:25-cv-04398-CKK        Document\n                                                             FOIA.gov         1-1\n                                                                      - Freedom         FiledAct:\n                                                                                of Information 12"}],"referredTo":null,"referred_to_id":null,"suitNature":"895 Freedom of Information Act","trustee_str":null}]}