{"count":360,"document_count":6955,"next":"https://www.courtlistener.com/api/rest/v4/search/?cursor=cz0xMzQzOTQzNDAwMDAwMC4wJnM9NzE5Nzg4NzAmdD1yJmQ9MjAyNi0wMi0xMyZwPTI%3D&order_by=dateFiled+desc&page_size=20&q=Ghislaine+Maxwell&type=r","previous":null,"results":[{"assignedTo":"Thomas D. Schroeder","assigned_to_id":2873,"attorney":["PRESIDENTIAL COMMITTEE/POLITICAL ACTION COMMITTEE/SEPARATE SEGREGATED FUND (SSF) NUMBER C00569897","RONALD SATISH EMRIT"],"attorney_id":[11232305,11211651],"caseName":"PRESIDENTIAL CANDIDATE NUMBER P60005535 v. CHERNIAVSKA OF WARSAW, POLAND","case_name_full":"","cause":"28:1331 Fed. Question","chapter":null,"court":"District Court, M.D. North Carolina","court_citation_string":"M.D.N.C.","court_id":"ncmd","dateArgued":null,"dateFiled":"2026-01-23","dateTerminated":null,"docketNumber":"1:26-cv-00085","docket_absolute_url":"/docket/72184384/presidential-candidate-number-p60005535-v-cherniavska-of-warsaw-poland/","docket_id":72184384,"firm":["Ronald Satish Emrit"],"firm_id":[241134],"jurisdictionType":"Diversity","juryDemand":"None","meta":{"timestamp":"2026-02-01T08:27:19.570330Z","date_created":"2026-01-23T22:38:01.477568Z","score":{"bm25":13445222000000.0},"more_docs":false},"pacer_case_id":"103929","party":["WORLD BANK","RONALD SATISH EMRIT","KATERYNA OLOKOBA OF KHERSON,UKRAINE","INTERNATIONAL COURT OF JUSTICE OF HAGUE, NETHERLANDS","MARIA CHERNIAVSKA OF WARSAW, POLAND","ESTATE OF ALEXEI NAVALNY","UKRAINE","DARYA IGNATEVA OF KYIV, UKRAINE","ERIN BURNETT","COUNCIL ON FOREIGN RELATIONS","VOLODYMYR ZELENSKYY","UNITED NATIONS (UN)","PRESIDENTIAL COMMITTEE/POLITICAL ACTION COMMITTEE/SEPARATE SEGREGATED FUND (SSF) NUMBER C00569897","INTERNATIONAL MONETARY FUND (IMF)"],"party_id":[17196704,17196705,17196706,17196707,17196708,17196709,17231131,17196697,17196698,17196699,17196700,17196701,17196702,17196703],"recap_documents":[{"absolute_url":"/docket/72184384/2/presidential-candidate-number-p60005535-v-cherniavska-of-warsaw-poland/","attachment_number":null,"cites":[],"description":"COMPLAINT against All Defendants, filed by PRESIDENTIAL COMMITTEE/POLITICAL ACTION COMMITTEE/SEPARATE SEGREGATED FUND (SSF) NUMBER C00569897, PRESIDENTIAL CANDIDATE NUMBER P60005535. (Attachments: # 1 Envelope - Front and Back). (lks) (Entered: 01/25/2026)","docket_entry_id":451508726,"document_number":2,"document_type":"PACER Document","entry_date_filed":"2026-01-23","entry_number":2,"filepath_local":"recap/gov.uscourts.ncmd.103929/gov.uscourts.ncmd.103929.2.0.pdf","id":466352354,"is_available":true,"meta":{"timestamp":"2026-02-01T08:28:44.972331Z","date_created":"2026-01-25T23:19:03.635070Z"},"pacer_doc_id":"13304707294","page_count":12,"short_description":"Complaint","snippet":"IN THE UNITED STATES DISTRICT COURT FOR THE\nMIDDLE DISTRICT OF NORTH CAROLINA\n(John Hervey Wheeler Courthouse, 323 E. Chapel Hill Street,\nDurham, NC 27701,P.0. Box 1091, Durham, NC 277071 )\n\nPresidential Candidate Number P60005535 [s / ait BiG\n“also known as” (aka) Ronald Satish Emrit, lh a\n\\o\\ | {i\n\n)\n)\n\n& Presidential Committee/Political Action ) NA Se\n)\n\n—\nND\n\nCommittee/Separate Segregated Fund (SSF)\nNumber C00569897 d/b/a United\n\nEmrits of America )\nPlaintiffs (Pro Se) )\n) C. A.No.: 1:26CV85"}],"referredTo":"Lawrence Patrick Auld","referred_to_id":9360,"suitNature":"360 P.I.: Other","trustee_str":null},{"assignedTo":"Royce C. Lamberth","assigned_to_id":1844,"attorney":["Adam Alexander Marshall"],"attorney_id":[11176580],"caseName":"CENTER FOR INVESTIGATIVE REPORTING v. FEDERAL BUREAU OF PRISONS","case_name_full":"","cause":"05:552 Freedom of Information Act","chapter":null,"court":"District Court, District of Columbia","court_citation_string":"D.D.C.","court_id":"dcd","dateArgued":null,"dateFiled":"2026-01-14","dateTerminated":null,"docketNumber":"1:26-cv-00104","docket_absolute_url":"/docket/72143409/center-for-investigative-reporting-v-federal-bureau-of-prisons/","docket_id":72143409,"firm":["Reporters Committee for Freedom of the Press"],"firm_id":[360383],"jurisdictionType":"U.S. Government Defendant","juryDemand":"None","meta":{"timestamp":"2026-01-16T15:46:09.508930Z","date_created":"2026-01-14T19:23:47.580664Z","score":{"bm25":13444445000000.0},"more_docs":false},"pacer_case_id":"288440","party":["CENTER FOR INVESTIGATIVE REPORTING","FEDERAL BUREAU OF PRISONS"],"party_id":[17135556,17135557],"recap_documents":[{"absolute_url":"/docket/72143409/1/center-for-investigative-reporting-v-federal-bureau-of-prisons/","attachment_number":null,"cites":[],"description":"COMPLAINT against FEDERAL BUREAU OF PRISONS ( Filing fee $ 405 receipt number ADCDC-12185692) filed by CENTER FOR INVESTIGATIVE REPORTING. (Attachments: # 1 Exhibit 1, # 2 Exhibit 2, # 3 Exhibit 3, # 4 Civil Cover Sheet, # 5 Summons)(Marshall, Adam) (Entered: 01/14/2026)","docket_entry_id":450308294,"document_number":1,"document_type":"PACER Document","entry_date_filed":"2026-01-14","entry_number":1,"filepath_local":"recap/gov.uscourts.dcd.288440/gov.uscourts.dcd.288440.1.0.pdf","id":465122697,"is_available":true,"meta":{"timestamp":"2026-01-16T15:46:32.138723Z","date_created":"2026-01-14T19:23:48.469420Z"},"pacer_doc_id":"045011851001","page_count":7,"short_description":"Complaint","snippet":"       Case 1:26-cv-00104-RCL       Document 1     Filed 01/14/26   Page 1 of 7\n\n\n\n\n                     IN THE UNITED STATES DISTRICT COURT\n                         FOR THE DISTRICT OF COLUMBIA\n\n\n\nCENTER FOR INVESTIGATIVE\nREPORTING\nPO Box 584\nSan Francisco, CA 94104\n\n                     Plaintiff,\n\n       v.                                          Civil Action No. ______________\n\nFEDERAL BUREAU OF PRISONS\n320 First Street, NW\nWashington, DC 20534\n\n                     Defendant.\n\n\n      COMPL"}],"referredTo":null,"referred_to_id":null,"suitNature":"895 Freedom of Information Act","trustee_str":null},{"assignedTo":"Martin Karl Reidinger","assigned_to_id":2692,"attorney":[],"attorney_id":[],"caseName":"Presidential Candidate Number P60005535 v. Cherniavska","case_name_full":"","cause":"28:1332 Diversity-Declaratory Judgment","chapter":null,"court":"District Court, W.D. North Carolina","court_citation_string":"W.D.N.C.","court_id":"ncwd","dateArgued":null,"dateFiled":"2026-01-12","dateTerminated":null,"docketNumber":"1:26-cv-00015","docket_absolute_url":"/docket/72131576/presidential-candidate-number-p60005535-v-cherniavska/","docket_id":72131576,"firm":[],"firm_id":[],"jurisdictionType":"","juryDemand":"","meta":{"timestamp":"2026-02-10T09:40:20.056761Z","date_created":"2026-01-12T18:37:20.512979Z","score":{"bm25":13444272000000.0},"more_docs":false},"pacer_case_id":"122377","party":["Presidential Candidate Number P60005535","Cherniavska"],"party_id":[],"recap_documents":[{"absolute_url":"/docket/72131576/1/presidential-candidate-number-p60005535-v-cherniavska/","attachment_number":null,"cites":[],"description":"","docket_entry_id":450022497,"document_number":1,"document_type":"PACER Document","entry_date_filed":"2026-01-12","entry_number":1,"filepath_local":"recap/gov.uscourts.ncwd.122377/gov.uscourts.ncwd.122377.1.0.pdf","id":464830051,"is_available":true,"meta":{"timestamp":"2026-02-10T09:40:20.043213Z","date_created":"2026-01-12T19:17:08.788938Z"},"pacer_doc_id":"13505747117","page_count":12,"short_description":"Complaint","snippet":"IN THE UNITED STATES DISTRICT COURT FOR THE\nWESTERN DISTRICT OF NORTH CAROLINA\n(United States Courthouse, 100 Otis Street, Room 309, Asheville, NC\n\n28801)\nve FILED\n) w.. ASHEVILLE, NC\n) JAN 42 2026\nPresidential Candidate Number P60005535 ) U.S. DISTRICT COURT\n“also known as” (aka) Ronald Satish Emrit, ) W. DISTRICT OF N.C,\n& Presidential Committee/Political Action )\n\nCommittee/Separate Segregated Fund (SSF) )\n\nNumber C00569897 d/b/a United )\nEmrits of America )\nPlaintiffs (Pro Se) )\n) C. A. No.:"}],"referredTo":"William C. Metcalf","referred_to_id":9365,"suitNature":"P.I.: Other","trustee_str":null},{"assignedTo":"Sharon Louise Gleason","assigned_to_id":1215,"attorney":["Ronald Satish Emrit"],"attorney_id":[11161475],"caseName":"Emrit v. Snoop Doggy Dogg","case_name_full":"","cause":"No cause code entered","chapter":null,"court":"District Court, D. Alaska","court_citation_string":"D. Alaska","court_id":"akd","dateArgued":null,"dateFiled":"2026-01-07","dateTerminated":null,"docketNumber":"3:26-cv-00007","docket_absolute_url":"/docket/72120087/emrit-v-snoop-doggy-dogg/","docket_id":72120087,"firm":["Ronald Satish Emrit"],"firm_id":[231512],"jurisdictionType":"Diversity","juryDemand":"Plaintiff","meta":{"timestamp":"2026-01-13T20:21:42.015020Z","date_created":"2026-01-08T19:45:44.938406Z","score":{"bm25":13443840000000.0},"more_docs":false},"pacer_case_id":"77866","party":["Roger Goodell","The Racist State of Arizona","NBC","Estate of Eazy E Eric Wright","Snoop Doggy Dogg","Vivendi Universal","Dr. Dre","United States Olympic Committee (USOC)","NBC Universal","Comcast","Mike Tirico","Ice Cube","Jay-Z","Super Bowl Halftime Show","Kendrick Lamar","Peacock","Snoop Doggy Dogg Bowl in Arizona","National Football League (NFL)","Sunday Night Football","Cris Collinsworth","Bad Bunny","Ronald Satish Emrit"],"party_id":[17106741,17106744,17106745,17106746,17106747,17106748,17106749,17106750,17106751,17106752,17106753,17106754,17106755,17106756,17106757,17106758,17106759,17106760,17106761,17106762,17106763,17129674],"recap_documents":[{"absolute_url":"/docket/72120087/1/emrit-v-snoop-dogg-dogg/","attachment_number":null,"cites":[],"description":"COMPLAINT against All Defendants, filed by Ronald Satish Emrit. (Attachments: # 1 Exhibit A, # 2 Exhibit B, # 3 Exhibit C, # 4 Exhibit D, # 5 Exhibit E)(PXS, COURT STAFF) (Entered: 01/08/2026)","docket_entry_id":449692400,"document_number":1,"document_type":"PACER Document","entry_date_filed":"2026-01-07","entry_number":1,"filepath_local":"recap/gov.uscourts.akd.77866/gov.uscourts.akd.77866.1.0.pdf","id":464492270,"is_available":true,"meta":{"timestamp":"2026-01-13T20:29:58.021174Z","date_created":"2026-01-08T20:13:16.425180Z"},"pacer_doc_id":"02303095970","page_count":16,"short_description":"Complaint","snippet":"           IN THE UNITED STATES DISTRICT COURT FOR THE\n                           DISTRICT OF ALASKA\n\n   (U.S. District Court, 222 W. 7th Avenue, Room 229, Box/Suite #4,\n\n\n\n                                            )\n                                                 )\nSatish Dat Beast (Former Client of               )\n                                                                     u«a\n\n\n“Larry Birkhead Attorney” Nancy Hass        )\nof Hallandale Beach, Florida as Family Law   )\n           "}],"referredTo":null,"referred_to_id":null,"suitNature":"360 P.I.: Other","trustee_str":null},{"assignedTo":"Lawrence Joseph Vilardo","assigned_to_id":8645,"attorney":[],"attorney_id":[],"caseName":"Presidential Candidate Number P60005535 v. Cherniavska","case_name_full":"","cause":"","chapter":null,"court":"District Court, W.D. New York","court_citation_string":"W.D.N.Y.","court_id":"nywd","dateArgued":null,"dateFiled":"2026-01-06","dateTerminated":null,"docketNumber":"1:26-cv-00009","docket_absolute_url":"/docket/72109198/presidential-candidate-number-p60005535-v-cherniavska/","docket_id":72109198,"firm":[],"firm_id":[],"jurisdictionType":"","juryDemand":"","meta":{"timestamp":"2026-01-06T19:38:00.452126Z","date_created":"2026-01-06T18:37:57.351136Z","score":{"bm25":13443754000000.0},"more_docs":false},"pacer_case_id":"159561","party":["Presidential Candidate Number P60005535","Cherniavska"],"party_id":[],"recap_documents":[{"absolute_url":"/docket/72109198/1/presidential-candidate-number-p60005535-v-cherniavska/","attachment_number":null,"cites":[],"description":"","docket_entry_id":449469074,"document_number":1,"document_type":"PACER Document","entry_date_filed":"2026-01-06","entry_number":1,"filepath_local":"recap/gov.uscourts.nywd.159561/gov.uscourts.nywd.159561.1.0.pdf","id":464263792,"is_available":true,"meta":{"timestamp":"2026-01-07T11:30:48.682867Z","date_created":"2026-01-07T11:30:22.225220Z"},"pacer_doc_id":"12906880020","page_count":14,"short_description":"Complaint","snippet":"Case 1:26-cv-00009-LJV Document1 Filed 01/06/26 Page1of14\n\nIN THE UNITED STATES DISTRICT COURT FOR THE\nWESTERN DISTRICT OF NEW YORK\n(100 State Street, Rochester, NY 14614)\n\n)\n\n)\nPresidential Candidate Number P60005535 )\n“also known as” (aka) Ronald Satish Emrit, )\n& Presidential Committee/Political Action )\nCommittee/Separate Segregated Fund (SSF) )\nNumber C00569897 d/b/a United )\n\nEmrits of America )\nPlaintiffs (Pro Se) ) _\n) CA.No: 26-cv- Y LV\nVv. )\n\n)\nMaria Cherniavska of Warsaw, Poland (Futu"}],"referredTo":null,"referred_to_id":null,"suitNature":"","trustee_str":null},{"assignedTo":"Mary Kay Vyskocil","assigned_to_id":null,"attorney":["Caryn Gail Schechtman"],"attorney_id":[11098736],"caseName":"Wolff v. Trump","case_name_full":"","cause":"28:1332 Diversity Action","chapter":null,"court":"District Court, S.D. New York","court_citation_string":"S.D.N.Y.","court_id":"nysd","dateArgued":null,"dateFiled":"2025-12-29","dateTerminated":null,"docketNumber":"1:25-cv-10752","docket_absolute_url":"/docket/72085702/wolff-v-trump/","docket_id":72085702,"firm":["Dla Piper US LLP (Ny)"],"firm_id":[273943],"jurisdictionType":"Diversity","juryDemand":"None","meta":{"timestamp":"2025-12-30T19:17:02.151696Z","date_created":"2025-12-29T22:21:06.038689Z","score":{"bm25":13443062000000.0},"more_docs":false},"pacer_case_id":"655484","party":["Melania Trump","Michael Wolff"],"party_id":[17029833,17029834],"recap_documents":[{"absolute_url":"/docket/72085702/15/wolff-v-trump/","attachment_number":null,"cites":[],"description":"","docket_entry_id":453293840,"document_number":15,"document_type":"PACER Document","entry_date_filed":"2026-02-09","entry_number":15,"filepath_local":"recap/gov.uscourts.nysd.655484/gov.uscourts.nysd.655484.15.0.pdf","id":468182252,"is_available":true,"meta":{"timestamp":"2026-02-10T13:57:08.498921Z","date_created":"2026-02-10T05:09:00.295726Z"},"pacer_doc_id":"127039040393","page_count":13,"short_description":"Declaration in Support of Motion","snippet":"Case 1:25-cv-10752-MKV Document15 ~~ Filed 02/09/26 Page 1 of 13\n\nUNITED STATES DISTRICT COURT\nSOUTHERN DISTRICT OF NEW YORK\n\nMICHAEL WOLFF, Case No. 1:25-cv-10752-MKV-SC\n\nPlaintiff, DECLARATION OF\nv. DAVID S. KORZENIK\nIN SUPPORT OF PLAINTIFF\nWOLFF’S CROSS-MOTION AND\n\nMELANIA TRUMP, IN OPPOSITION TO DEFENDANT\n\nDefendant. MELANIA TRUMP’S MOTION TO\nDISMISS, ETC.\n\nDavid S. Korzenik, Esq. , pursuant to 28 USC 1746, affirms the following facts to be\n\ntrue on personal knowledge or on information and b"}],"referredTo":null,"referred_to_id":null,"suitNature":"320 Assault Libel & Slander","trustee_str":null},{"assignedTo":"Analisa Nadine Torres","assigned_to_id":3243,"attorney":["Arick W. Fudali"],"attorney_id":[10970129],"caseName":"Jane Doe 1 v. United States","case_name_full":"","cause":"28:1346 U.S. Defendant","chapter":null,"court":"District Court, S.D. New York","court_citation_string":"S.D.N.Y.","court_id":"nysd","dateArgued":null,"dateFiled":"2025-12-19","dateTerminated":null,"docketNumber":"1:25-cv-10558","docket_absolute_url":"/docket/72061309/jane-doe-1-v-united-states/","docket_id":72061309,"firm":["The Bloom Firm"],"firm_id":[571676],"jurisdictionType":"Federal Question","juryDemand":"Plaintiff","meta":{"timestamp":"2025-12-19T20:25:16.380121Z","date_created":"2025-12-19T19:40:23.621679Z","score":{"bm25":13442198000000.0},"more_docs":false},"pacer_case_id":"655153","party":["Jane Doe 5","Jane Doe 2","Jane Doe 8","Jane Doe 3","Jane Doe 4","Jane Doe 6","United States of America","Jane Doe 7","Jane Doe 1"],"party_id":[16882615,16882616,16882617,16882618,16882619,16882620,16882621,16882622,16882623],"recap_documents":[{"absolute_url":"/docket/72061309/1/jane-doe-1-v-united-states/","attachment_number":null,"cites":[],"description":"COMPLAINT against United States of America. (Filing Fee $ 405.00, Receipt Number 45536)Document filed by Jane Doe 6, Jane Doe 2, Jane Doe 4, Jane Doe 5, Jane Doe 8, Jane Doe 1, Jane Doe 7, Jane Doe 3.(vf) (Entered: 12/19/2025)","docket_entry_id":447819214,"document_number":1,"document_type":"PACER Document","entry_date_filed":"2025-12-19","entry_number":1,"filepath_local":"recap/gov.uscourts.nysd.655153/gov.uscourts.nysd.655153.1.0.pdf","id":462580426,"is_available":true,"meta":{"timestamp":"2025-12-19T21:14:25.107124Z","date_created":"2025-12-19T20:25:17.189285Z"},"pacer_doc_id":"127038767186","page_count":25,"short_description":"Complaint","snippet":"            Case 1:25-cv-10558-AT               Document 1          Filed 12/19/25         Page 1 of 25\n\n\n\n\n                                  UNITED STATES DISTRICT COURT\n                                 SOUTHERN DISTRICT OF NEW YORK\n\n\n\n                                                               COMPLAINT\nJANE DOE 1, JANE DOE 2, JANE DOE 3,\nJANE DOE 4, JANE DOE 5, JANE DOE 6,                            JURY TRIAL DEMANDED\nJANE DOE 7, and JANE DOE 8\n\n\n\n                                    Plain"}],"referredTo":null,"referred_to_id":null,"suitNature":"360 P.I.: Other","trustee_str":null},{"assignedTo":"Colleen Kollar-Kotelly","assigned_to_id":1810,"attorney":["Stephen Stich Match","Merrick Jason Wayne","Matthew Topic"],"attorney_id":[10967516,10967517,10967518],"caseName":"LEOPOLD v. U.S. DEPARTMENT OF JUSTICE","case_name_full":"","cause":"05:552 Freedom of Information Act","chapter":null,"court":"District Court, District of Columbia","court_citation_string":"D.D.C.","court_id":"dcd","dateArgued":null,"dateFiled":"2025-12-18","dateTerminated":null,"docketNumber":"1:25-cv-04398","docket_absolute_url":"/docket/72053579/leopold-v-us-department-of-justice/","docket_id":72053579,"firm":["Loevy & Loevy"],"firm_id":[831321],"jurisdictionType":"U.S. Government Defendant","juryDemand":"None","meta":{"timestamp":"2025-12-19T21:38:33.101042Z","date_created":"2025-12-18T17:11:07.562124Z","score":{"bm25":13442112000000.0},"more_docs":false},"pacer_case_id":"287838","party":["U.S. DEPARTMENT OF JUSTICE","BLOOMBERG L.P.","JASON LEOPOLD","FEDERAL BUREAU OF PRISONS"],"party_id":[16878481,16878482,16878483,16878484],"recap_documents":[{"absolute_url":"/docket/72053579/1/leopold-v-us-department-of-justice/","attachment_number":null,"cites":[],"description":"COMPLAINT against FEDERAL BUREAU OF PRISONS, U.S. DEPARTMENT OF JUSTICE ( Filing fee $ 405 receipt number ADCDC-12144485) filed by JASON LEOPOLD, BLOOMBERG L.P.. (Attachments: # 1 Exhibit 1-2, # 2 Civil Cover Sheet, # 3 Summons)(Topic, Matthew) (Entered: 12/18/2025)","docket_entry_id":447639130,"document_number":1,"document_type":"PACER Document","entry_date_filed":"2025-12-18","entry_number":1,"filepath_local":"recap/gov.uscourts.dcd.287838/gov.uscourts.dcd.287838.1.0.pdf","id":462396875,"is_available":true,"meta":{"timestamp":"2025-12-20T16:44:21.942839Z","date_created":"2025-12-18T17:25:42.935590Z"},"pacer_doc_id":"045011807775","page_count":4,"short_description":"Complaint","snippet":"        Case 1:25-cv-04398-CKK             Document 1   Filed 12/18/25      Page 1 of 4\n\n\n                       IN THE UNITED STATES DISTRICT COURT\n                           FOR THE DISTRICT OF COLUMBIA\n\nJASON LEOPOLD,                                   )\n                                                 )\nBLOOMBERG L.P.,                                  )\n731 Lexington Ave                                )\nNew York, NY 10022                               )\n                                       "},{"absolute_url":"/docket/72053579/1/1/leopold-v-us-department-of-justice/","attachment_number":1,"cites":[],"description":"COMPLAINT against FEDERAL BUREAU OF PRISONS, U.S. DEPARTMENT OF JUSTICE ( Filing fee $ 405 receipt number ADCDC-12144485) filed by JASON LEOPOLD, BLOOMBERG L.P.. (Attachments: # 1 Exhibit 1-2, # 2 Civil Cover Sheet, # 3 Summons)(Topic, Matthew) (Entered: 12/18/2025)","docket_entry_id":447639130,"document_number":1,"document_type":"Attachment","entry_date_filed":"2025-12-18","entry_number":1,"filepath_local":"recap/gov.uscourts.dcd.287838/gov.uscourts.dcd.287838.1.1.pdf","id":462467300,"is_available":true,"meta":{"timestamp":"2025-12-19T21:39:09.050323Z","date_created":"2025-12-18T23:02:35.496786Z"},"pacer_doc_id":"045011807776","page_count":13,"short_description":"Exhibit 1-2","snippet":"Case 1:25-cv-04398-CKK   Document 1-1   Filed 12/18/25   Page 1 of 13\n                                                                        Exhibit 1\n\f                               Case 1:25-cv-04398-CKK        Document\n                                                             FOIA.gov         1-1\n                                                                      - Freedom         FiledAct:\n                                                                                of Information 12"}],"referredTo":null,"referred_to_id":null,"suitNature":"895 Freedom of Information Act","trustee_str":null},{"assignedTo":"Paul Adam Engelmayer","assigned_to_id":997,"attorney":["Ghislaine Maxwell"],"attorney_id":[10963095],"caseName":"Maxwell v. United States","case_name_full":"","cause":"28:2255 Motion to Vacate / Correct Illegal Sentenc","chapter":null,"court":"District Court, S.D. New York","court_citation_string":"S.D.N.Y.","court_id":"nysd","dateArgued":null,"dateFiled":"2025-12-17","dateTerminated":null,"docketNumber":"1:25-cv-10468","docket_absolute_url":"/docket/72049995/maxwell-v-united-states/","docket_id":72049995,"firm":["Reg. No. 02879-509, Federal Correctional Institution Bryan"],"firm_id":[1131090],"jurisdictionType":"U.S. Government Defendant","juryDemand":"None","meta":{"timestamp":"2025-12-17T21:36:58.184108Z","date_created":"2025-12-17T21:10:33.627429Z","score":{"bm25":13442026000000.0},"more_docs":true},"pacer_case_id":"654959","party":["Ghislaine Maxwell","United States of America"],"party_id":[16868237,16875654],"recap_documents":[{"absolute_url":"","attachment_number":null,"cites":[],"description":"MAILING RECEIPT: Document No: 2. Mailed to: Ghislaine Maxwell Reg.No.02879-509 Federal Correctional Institution Bryan 1100 U.S. Highway Bryan 281 Bryan, TX 77803. (tp)","docket_entry_id":448564280,"document_number":null,"document_type":"PACER Document","entry_date_filed":"2025-12-19","entry_number":null,"filepath_local":null,"id":463340559,"is_available":false,"meta":{"timestamp":"2025-12-29T15:43:24.804475Z","date_created":"2025-12-29T15:43:24.736161Z"},"pacer_doc_id":"","page_count":null,"short_description":"","snippet":""},{"absolute_url":"","attachment_number":null,"cites":[],"description":"MAILING RECEIPT: Document No: 4. Mailed to: Ghislaine Maxwell Reg.No.02879-509 Federal Correctional Institution Bryan 1100 U.S. Highway Bryan 281 Bryan, TX 77803. (tp)","docket_entry_id":448564282,"document_number":null,"document_type":"PACER Document","entry_date_filed":"2025-12-23","entry_number":null,"filepath_local":null,"id":463340561,"is_available":false,"meta":{"timestamp":"2025-12-29T15:43:25.002611Z","date_created":"2025-12-29T15:43:24.925415Z"},"pacer_doc_id":"","page_count":null,"short_description":"","snippet":""},{"absolute_url":"","attachment_number":null,"cites":[],"description":"MAILING RECEIPT: Document No: 6. Mailed to: Ghislaine Maxwell Reg.No.02879-509 Federal Correctional Institution Bryan 1100 U.S. Highway Bryan 281 Bryan, TX 77803. (ne)","docket_entry_id":452010020,"document_number":null,"document_type":"PACER Document","entry_date_filed":"2026-01-13","entry_number":null,"filepath_local":null,"id":466868595,"is_available":false,"meta":{"timestamp":"2026-01-29T17:29:42.947008Z","date_created":"2026-01-29T17:29:42.885182Z"},"pacer_doc_id":"","page_count":null,"short_description":"","snippet":""}],"referredTo":null,"referred_to_id":null,"suitNature":"510 Prisoner: Vacate Sentence","trustee_str":null},{"assignedTo":"Unassigned","assigned_to_id":null,"attorney":["Ghislaine Maxwell"],"attorney_id":[10962918],"caseName":"Maxwell v. United States","case_name_full":"","cause":"28:2255 Motion to Vacate / Correct Illegal Sentenc","chapter":null,"court":"District Court, S.D. New York","court_citation_string":"S.D.N.Y.","court_id":"nysd","dateArgued":null,"dateFiled":"2025-12-17","dateTerminated":null,"docketNumber":"1:25-cv-10464","docket_absolute_url":"/docket/72049470/maxwell-v-united-states/","docket_id":72049470,"firm":["Federal Correctional Institution Bryan"],"firm_id":[1130761],"jurisdictionType":"U.S. Government Defendant","juryDemand":"None","meta":{"timestamp":"2025-12-17T21:01:46.538174Z","date_created":"2025-12-17T20:16:35.818732Z","score":{"bm25":13442026000000.0},"more_docs":true},"pacer_case_id":"654951","party":["United States of America","Ghislaine Maxwell"],"party_id":[16868090,16868091],"recap_documents":[{"absolute_url":"/docket/72049470/1/maxwell-v-united-states/","attachment_number":null,"cites":[2467,102436,104579,105912,105978,108471,112428,307845,457698,470300,710271,713017,783299,792809,802161,1440930,1455882,1478409,4525041,4702441,6972951,7235406,9282841,9422583,9424699,9424708,9426498,9427563,9428656,9429434,9429651,9430259,9430412,9430981,9431483,9433120,9433839,9457752,9490951,9491377,9494671,9495015,9873105,9901352],"description":"PETITION FOR WRIT OF HABEAS CORPUS PURSUANT TO 28 U.S.C. § 2255.Document filed by Ghislaine Maxwell. (Attachments: # 1 Exhibit 1, # 2 Exhibit 2, # 3 Exhibit 3, # 4 Exhibit 4, # 5 Exhibit 5, # 6 Exhibit 6).(kgo) (Additional attachment(s) added on 12/17/2025: # 7 Exhibit 7, # 8 Exhibit 8, # 9 Exhibit 9, # 10 Exhibit 10, # 11 Exhibit 11) (kgo). Modified on 12/17/2025 (kgo). (Entered: 12/17/2025)","docket_entry_id":447526896,"document_number":1,"document_type":"PACER Document","entry_date_filed":"2025-12-17","entry_number":1,"filepath_local":"recap/gov.uscourts.nysd.654951/gov.uscourts.nysd.654951.1.0_2.pdf","id":462281845,"is_available":true,"meta":{"timestamp":"2025-12-17T21:09:41.990006Z","date_created":"2025-12-17T20:26:55.479757Z"},"pacer_doc_id":"127038750090","page_count":9,"short_description":"Motion to Vacate/Set Aside/Correct Sentence (2255)","snippet":"Case 1:25-cv-10464-UA Document1 Filed 12/17/25 Pagelof9\n\nUNITED STATES DISTRICT COURT SOUTHERN DISTRICT OF NEW YORK\n\nUNITED STATES OF AMERICA, Plaintiff,\nv.\n\nGHISLAINE MAXWELL, | Defendant\nCase No. 20-CR-330 (AJN)\n\nPETITION FOR WRIT OF HABEAS CORPUS PURSUANT\nTO 28 U.S.C. § 2255\n\nGhislaine Maxwell 02879-509 Petition for Writ of Habeas Corpus\npursuant to 28 U.S.C. § 2255\n\n\fCase 1:25-cv-10464-UA Document1 Filed 12/17/25 Page2of9\n\nCASES\ni\n\nArizona Vv. Youngblood, 488 U.S. 51 (1988 ..sesssssesssssnne"},{"absolute_url":"/docket/72049470/1/6/maxwell-v-united-states/","attachment_number":6,"cites":[104579,107247,112428,9424708],"description":"PETITION FOR WRIT OF HABEAS CORPUS PURSUANT TO 28 U.S.C. § 2255.Document filed by Ghislaine Maxwell. (Attachments: # 1 Exhibit 1, # 2 Exhibit 2, # 3 Exhibit 3, # 4 Exhibit 4, # 5 Exhibit 5, # 6 Exhibit 6).(kgo) (Additional attachment(s) added on 12/17/2025: # 7 Exhibit 7, # 8 Exhibit 8, # 9 Exhibit 9, # 10 Exhibit 10, # 11 Exhibit 11) (kgo). Modified on 12/17/2025 (kgo). (Entered: 12/17/2025)","docket_entry_id":447526896,"document_number":1,"document_type":"Attachment","entry_date_filed":"2025-12-17","entry_number":1,"filepath_local":"recap/gov.uscourts.nysd.654951/gov.uscourts.nysd.654951.1.6.pdf","id":462281853,"is_available":true,"meta":{"timestamp":"2025-12-17T21:01:46.840560Z","date_created":"2025-12-17T20:27:02.707223Z"},"pacer_doc_id":"127038750096","page_count":7,"short_description":"Exhibit 6","snippet":" Case 1:25-cv-10464-UA            Document 1-6        Filed 12/17/25       Page 1 of 7\n\n\n\n\nallowed the Government ot keep investigating Epstein and the co-conspirators exploiting\ncivil litigation and discovery. The ongoing litigation allowed continued press collusion ot\npush a false narrative through friendly journalists like Sharon Churcher and JKB.\n        The plaintiff's lawyers representing the complainants had approached the SDNY\nin 2016 in an effort to promote and instigate a criminal pros"},{"absolute_url":"/docket/72049470/1/3/maxwell-v-united-states/","attachment_number":3,"cites":[2467,108471,112153,470300,710271,723746,783299,9424699,9429651,9430259,9433285,9433839,9434551,9457752],"description":"PETITION FOR WRIT OF HABEAS CORPUS PURSUANT TO 28 U.S.C. § 2255.Document filed by Ghislaine Maxwell. (Attachments: # 1 Exhibit 1, # 2 Exhibit 2, # 3 Exhibit 3, # 4 Exhibit 4, # 5 Exhibit 5, # 6 Exhibit 6).(kgo) (Additional attachment(s) added on 12/17/2025: # 7 Exhibit 7, # 8 Exhibit 8, # 9 Exhibit 9, # 10 Exhibit 10, # 11 Exhibit 11) (kgo). Modified on 12/17/2025 (kgo). (Entered: 12/17/2025)","docket_entry_id":447526896,"document_number":1,"document_type":"Attachment","entry_date_filed":"2025-12-17","entry_number":1,"filepath_local":"recap/gov.uscourts.nysd.654951/gov.uscourts.nysd.654951.1.3.pdf","id":462281850,"is_available":true,"meta":{"timestamp":"2025-12-17T21:01:46.848106Z","date_created":"2025-12-17T20:27:02.628937Z"},"pacer_doc_id":"127038750093","page_count":7,"short_description":"Exhibit 3","snippet":"     Case 1:25-cv-10464-UA           Document 1-3         Filed 12/17/25       Page 1 of 7\n\n\n\n\n      .5 Petitioner was denied her 6 ' Amendment Rights by the Prosecution when the\n         SDNY decided ot illegally indict her ni White Plains and have her ni custody\n         before the first anniversary of Epstein's death ni violation of her 6tth Amendment\n         rights solely for political theater. Further in petitioning this Court to release\n         Petitioner's grand jury materials the SDNY "}],"referredTo":null,"referred_to_id":null,"suitNature":"440 Civil Rights: Other","trustee_str":null},{"assignedTo":"Phillip J. Caraballo","assigned_to_id":null,"attorney":["Presidential Candidate Number P60005535"],"attorney_id":[10961609],"caseName":"Presidential Candidate Number P60005535 v. Kardashian","case_name_full":"","cause":"28:2671 Federal Tort Claims Act","chapter":null,"court":"District Court, M.D. Pennsylvania","court_citation_string":"M.D. Penn.","court_id":"pamd","dateArgued":null,"dateFiled":"2025-12-16","dateTerminated":null,"docketNumber":"3:25-cv-02436","docket_absolute_url":"/docket/72045006/presidential-candidate-number-p60005535-v-kardashian/","docket_id":72045006,"firm":["Presidential Candidate Number P60005535"],"firm_id":[1109882],"jurisdictionType":"Diversity","juryDemand":"None","meta":{"timestamp":"2025-12-17T14:48:59.482883Z","date_created":"2025-12-16T22:09:16.476975Z","score":{"bm25":13441939000000.0},"more_docs":false},"pacer_case_id":"149562","party":["The Blair Witch (Moll Dyer) of Leonardtown","Pope Sixtus IV","Maryland in Saint Mary's County and not Burkittsville","Sabine Aisha Jules","Kelly Clarkson","ETSY Online Shopping","Jeffrey Rodriguez","Ye West","Greenland","Daryl Christopher Brooks","Dancing with the Stars (DWTS)","Maryland in Frederick Count","Denmark","Governor Oden Bowie of Collington","The Bering Strait Connecting Alaska and Russian","Maryland","Kim Kardashian","The Creation of Adam Painted by Michaelangelo","The Sistine Chapel","Maria Cherniavska","Ryan Seacrest","Alexandra Legagneur","The Mythical Priory of Sion Started by Pierre Plantard of France in 1956","Erin Burnett","Opus Dei (OD) of Vatican City","Gregory Legagneur","Presidential Candidate Number P60005535","Kelly Ripa","ALDI Grocery Store","Schrodinger's Cat","City of Key West, Florida","A$AP Rocky","The Copenhagen Interpretation of Quantum Physics/Mechanics","Robin Rihanna Fenty"],"party_id":[16866385,16866386,16866387,16866388,16866389,16866390,16866391,16866392,16866393,16866394,16866395,16866396,16866397,16866398,16866399,16866400,16866401,16866402,16866403,16866404,16866405,16866406,16866407,16866408,16866409,16866410,16866411,16866412,16866413,16866414,16866415,16866416,16866417,16866418],"recap_documents":[{"absolute_url":"/docket/72045006/1/presidential-candidate-number-p60005535-v-kardashian/","attachment_number":null,"cites":[],"description":"COMPLAINT against All Defendants lodged pending the disposition of the Motion for In Forma Pauperis, filed by Presidential Candidate Number P60005535. (Attachments: # 1 Civil Cover Sheet, # 2 Exhibit(s) A, # 3 Exhibit(s) B, # 4 Exhibit(s) C, # 5 Exhibit(s) D, # 6 Exhibit(s) E, # 7 Exhibit(s) F, # 8 Exhibit(s) G, # 9 Exhibit(s) H, # 10 Exhibit(s) I, # 11 Exhibit(s) J, # 12 Exhibit(s) K, # 13 Exhibit(s) L, # 14 Exhibit(s) M, # 15 Exhibit(s) N)(cac) (Entered: 12/16/2025)","docket_entry_id":447464674,"document_number":1,"document_type":"PACER Document","entry_date_filed":"2025-12-16","entry_number":1,"filepath_local":"recap/gov.uscourts.pamd.149562/gov.uscourts.pamd.149562.1.0.pdf","id":462217931,"is_available":true,"meta":{"timestamp":"2025-12-17T14:50:00.733838Z","date_created":"2025-12-17T14:49:00.400121Z"},"pacer_doc_id":"15509602519","page_count":17,"short_description":"","snippet":"Case 3:25-cv-02436-PJC Document1 Filed 12/16/25 Page1of17\n\nIN THE UNITED STATES DISTRICT COURT FOR THE\nMIDDLE DISTRICT OF PENNSYLVANIA\n(Max Rosenn U.S. Courthouse, 197 South Main Street, Wilkes-Barre,\nPA 18701 )\n\n)\n\n“also known as” (aka) Ronald Satish Emrit,\n\n& Presidential Committee/Political Action\n\nCommittee/Separate Segregated Fund (SSF) )\n\nNumber C00569897 d/b/a United )\n\nEmrits of America )\nPlaintiffs (Pro Se) )\n\n)\nPresidential Candidate Number P60005535 )\n)\n)\n\nC.A.No.: 4 95-CV-043G\n\nVv.\n\n"}],"referredTo":null,"referred_to_id":null,"suitNature":"440 Civil Rights: Other","trustee_str":null},{"assignedTo":"Tanya Sue Chutkan","assigned_to_id":620,"attorney":["Daniel Alexander McGrath"],"attorney_id":[10935961],"caseName":"DEMOCRACY FORWARD FOUNDATION v. U.S. DEPARTMENT OF JUSTICE","case_name_full":"","cause":"05:552 Freedom of Information Act","chapter":null,"court":"District Court, District of Columbia","court_citation_string":"D.D.C.","court_id":"dcd","dateArgued":null,"dateFiled":"2025-12-08","dateTerminated":null,"docketNumber":"1:25-cv-04270","docket_absolute_url":"/docket/72006903/democracy-forward-foundation-v-us-department-of-justice/","docket_id":72006903,"firm":["Democracy Forward Foundation"],"firm_id":[229186],"jurisdictionType":"U.S. Government Defendant","juryDemand":"None","meta":{"timestamp":"2025-12-10T20:07:02.679054Z","date_created":"2025-12-08T22:12:33.354189Z","score":{"bm25":13441248000000.0},"more_docs":false},"pacer_case_id":"287475","party":["FEDERAL BUREAU OF INVESTIGATION","DEMOCRACY FORWARD FOUNDATION","U.S. DEPARTMENT OF JUSTICE"],"party_id":[16808032,16808030,16808031],"recap_documents":[{"absolute_url":"/docket/72006903/1/democracy-forward-foundation-v-us-department-of-justice/","attachment_number":null,"cites":[],"description":"COMPLAINT against FEDERAL BUREAU OF INVESTIGATION, U.S. DEPARTMENT OF JUSTICE ( Filing fee $ 405 receipt number ADCDC-12121389) filed by DEMOCRACY FORWARD FOUNDATION. (Attachments: # 1 Civil Cover Sheet, # 2 Summons, # 3 Summons, # 4 Summons, # 5 Summons)(McGrath, Daniel) (Entered: 12/08/2025)","docket_entry_id":446532308,"document_number":1,"document_type":"PACER Document","entry_date_filed":"2025-12-08","entry_number":1,"filepath_local":"recap/gov.uscourts.dcd.287475/gov.uscourts.dcd.287475.1.0.pdf","id":461259153,"is_available":true,"meta":{"timestamp":"2025-12-10T20:07:02.482958Z","date_created":"2025-12-08T22:19:50.710919Z"},"pacer_doc_id":"045011783148","page_count":18,"short_description":"Complaint","snippet":"              Case 1:25-cv-04270      Document 1        Filed 12/08/25     Page 1 of 18\n\n\n\n\n                         IN THE UNITED STATES DISTRICT COURT\n                             FOR THE DISTRICT OF COLUMBIA\n\n\n DEMOCRACY FORWARD FOUNDATION,\n P.O. Box 34553\n Washington, D.C. 20043,\n\n Plaintiff,\n\n vs.\n                                                         Case No. 25-cv-4297\n U.S. DEPARTMENT OF JUSTICE\n 950 Pennsylvania Avenue, NW\n Washington, DC 20530\n\n FEDERAL BUREAU OF INVESTIGATION\n 935 P"}],"referredTo":null,"referred_to_id":null,"suitNature":"895 Freedom of Information Act","trustee_str":null},{"assignedTo":"Charles Petros Kocoras","assigned_to_id":1805,"attorney":["Samantha Rutcoskey"],"attorney_id":[10931715],"caseName":"Rutcoskey v. Swain","case_name_full":"","cause":"18:1961 Racketeering (RICO) Act","chapter":null,"court":"District Court, N.D. Illinois","court_citation_string":"N.D. Ill.","court_id":"ilnd","dateArgued":null,"dateFiled":"2025-12-03","dateTerminated":null,"docketNumber":"1:25-cv-14777","docket_absolute_url":"/docket/71999787/rutcoskey-v-swain/","docket_id":71999787,"firm":["Samantha Rutcoskey"],"firm_id":[1106136],"jurisdictionType":"Federal Question","juryDemand":"Plaintiff","meta":{"timestamp":"2025-12-06T05:05:45.241277Z","date_created":"2025-12-05T19:04:23.127070Z","score":{"bm25":13440816000000.0},"more_docs":false},"pacer_case_id":"491020","party":["Laura T. Swain","Samantha Rutcoskey"],"party_id":[16798139,16798140],"recap_documents":[{"absolute_url":"/docket/71999787/1/rutcoskey-v-swain/","attachment_number":null,"cites":[104490],"description":"RECEIVED Complaint and No copies by Samantha Rutcoskey (Received via pro se online portal on 12/03/25.) (lj, ) (Entered: 12/05/2025)","docket_entry_id":446370376,"document_number":1,"document_type":"PACER Document","entry_date_filed":"2025-12-03","entry_number":1,"filepath_local":"recap/gov.uscourts.ilnd.491020/gov.uscourts.ilnd.491020.1.0.pdf","id":461091036,"is_available":true,"meta":{"timestamp":"2025-12-06T05:10:29.079650Z","date_created":"2025-12-06T05:05:27.512924Z"},"pacer_doc_id":"067033681377","page_count":54,"short_description":"","snippet":"                           1:25-cv-14777\n\n                                                                                       D\n            Case: 1:25-cv-14777  Document #: 1 Filed: 12/03/25 Page 1 of 54 PageID #:1\nBC                                                                                 IVEPJJ\n                                                                            REC/3E\n                           Judge Charles P. Kocoras\n                           Magistrate Judge Gabriel A. Fu"}],"referredTo":null,"referred_to_id":null,"suitNature":"470 Racketeer/Corrupt Organization","trustee_str":null},{"assignedTo":"Mary M Rowland","assigned_to_id":10140,"attorney":["Kassidy Jo-Gee"],"attorney_id":[10931716],"caseName":"Jo-Gee v. Swain","case_name_full":"","cause":"18:1961 Racketeering (RICO) Act","chapter":null,"court":"District Court, N.D. Illinois","court_citation_string":"N.D. Ill.","court_id":"ilnd","dateArgued":null,"dateFiled":"2025-12-03","dateTerminated":null,"docketNumber":"1:25-cv-14779","docket_absolute_url":"/docket/71999221/jo-gee-v-swain/","docket_id":71999221,"firm":["Kassidy Jo-Gee"],"firm_id":[1127366],"jurisdictionType":"Federal Question","juryDemand":"Plaintiff","meta":{"timestamp":"2025-12-06T05:05:49.963927Z","date_created":"2025-12-05T17:54:27.274809Z","score":{"bm25":13440816000000.0},"more_docs":false},"pacer_case_id":"491011","party":["Kassidy Jo-Gee","Laura T. Swain"],"party_id":[16798141,16798142],"recap_documents":[{"absolute_url":"/docket/71999221/1/jo-gee-v-swain/","attachment_number":null,"cites":[104490],"description":"RECEIVED Complaint and No copies by Kassidy Jo-Gee (Received via pro se online portal on 12/03/25.) (lj, ) (Entered: 12/05/2025)","docket_entry_id":446370377,"document_number":1,"document_type":"PACER Document","entry_date_filed":"2025-12-03","entry_number":1,"filepath_local":"recap/gov.uscourts.ilnd.491011/gov.uscourts.ilnd.491011.1.0.pdf","id":461091039,"is_available":true,"meta":{"timestamp":"2025-12-06T05:11:32.355709Z","date_created":"2025-12-06T05:05:45.503354Z"},"pacer_doc_id":"067033680165","page_count":54,"short_description":"","snippet":"RECEIVEDPJJ\n        Case: 1:25-cv-14779 Document #: 1 Filed: 12/03/25 Page 1 of 54 PageID #:1\n                               1:25-cv-14779\n                               Judge Mary M. Rowland                      BC\n                               Magistrate Judge Heather K. McShain\n      12/3/2025                RANDOM / Cat. 2\n             . BRUTO    N\n   THOMA.SDG\n           IS T R IC T COURT     UNITED STATES DISTRICT COURT\nCLERK, U.S\n\n\n                         FOR THENORTHERN                "}],"referredTo":null,"referred_to_id":null,"suitNature":"470 Racketeer/Corrupt Organization","trustee_str":null},{"assignedTo":"Matthew F. Kennelly","assigned_to_id":1752,"attorney":["Dean"],"attorney_id":[10928640],"caseName":"Dean v. Swain","case_name_full":"","cause":"18:1961 Racketeering (RICO) Act","chapter":null,"court":"District Court, N.D. Illinois","court_citation_string":"N.D. Ill.","court_id":"ilnd","dateArgued":null,"dateFiled":"2025-12-03","dateTerminated":null,"docketNumber":"1:25-cv-14756","docket_absolute_url":"/docket/71996006/dean-v-swain/","docket_id":71996006,"firm":["Dean"],"firm_id":[1127004],"jurisdictionType":"Federal Question","juryDemand":"Plaintiff","meta":{"timestamp":"2025-12-05T07:58:47.610310Z","date_created":"2025-12-04T21:38:32.784071Z","score":{"bm25":13440816000000.0},"more_docs":false},"pacer_case_id":"490974","party":["Swain","Dean"],"party_id":[16790856,16790855],"recap_documents":[{"absolute_url":"/docket/71996006/1/dean-v-swain/","attachment_number":null,"cites":[104490],"description":"RECEIVED Complaint by Dean. (Received via pro se online portal on 12/03/2025.) (daj, ) (Entered: 12/04/2025)","docket_entry_id":446233868,"document_number":1,"document_type":"PACER Document","entry_date_filed":"2025-12-03","entry_number":1,"filepath_local":"recap/gov.uscourts.ilnd.490974/gov.uscourts.ilnd.490974.1.0.pdf","id":460951544,"is_available":true,"meta":{"timestamp":"2025-12-05T09:24:12.158428Z","date_created":"2025-12-05T05:08:33.853037Z"},"pacer_doc_id":"067033675729","page_count":54,"short_description":"","snippet":"                                                                                   D\n              1:25-cv-14756\n            Case: 1:25-cv-14756 Document #: 1 Filed: 12/03/25 Page 1 of 54 PageID #:1\nBC\n                                                                            RECEIVEQR\n              Judge Matthew F. Kennelly\n              Magistrate Judge Jeannice W. Appenteng\n              RANDOM/ CAT.2                                                 2/3/20251\n                                 "}],"referredTo":null,"referred_to_id":null,"suitNature":"470 Racketeer/Corrupt Organization","trustee_str":null},{"assignedTo":null,"assigned_to_id":null,"attorney":["Deborah Maxine Golden"],"attorney_id":[10912594],"caseName":"H.M. v. UNITED STATES OF AMERICA","case_name_full":"","cause":"28:1983 Civil Rights","chapter":null,"court":"District Court, District of Columbia","court_citation_string":"D.D.C.","court_id":"dcd","dateArgued":null,"dateFiled":"2025-11-26","dateTerminated":null,"docketNumber":"1:25-cv-04164","docket_absolute_url":"/docket/71971006/hm-v-united-states-of-america/","docket_id":71971006,"firm":["The Law Office of Deborah M. Golden"],"firm_id":[744528],"jurisdictionType":"Federal Question","juryDemand":"None","meta":{"timestamp":"2025-12-01T20:39:14.655781Z","date_created":"2025-11-26T22:25:09.800868Z","score":{"bm25":13440211000000.0},"more_docs":false},"pacer_case_id":"287205","party":["H.M.","A.L.","J.P.","J.G.","K.T.","BETH REESE","UNITED STATES OF AMERICA","C.L."],"party_id":[16765930,16765931,16765932,16765933,16765934,16765935,16765936,16753843],"recap_documents":[{"absolute_url":"/docket/71971006/1/mh-v-federal-tort-claims-act-section/","attachment_number":null,"cites":[769497,2522066,9412718],"description":"COMPLAINT against All Defendants ( Filing fee $ 405 receipt number ADCDC-12103067) filed by C LC, A LA, J PJ, H MH, J GJ. (Attachments: # 1 Civil Cover Sheet, # 2 Summons, # 3 Summons, # 4 Summons, # 5 Summons)(Golden, Deborah) (Entered: 11/26/2025)","docket_entry_id":445546467,"document_number":1,"document_type":"PACER Document","entry_date_filed":"2025-11-26","entry_number":1,"filepath_local":"recap/gov.uscourts.dcd.287205/gov.uscourts.dcd.287205.1.0.pdf","id":460245968,"is_available":true,"meta":{"timestamp":"2025-12-01T20:39:14.695578Z","date_created":"2025-11-26T23:23:06.781925Z"},"pacer_doc_id":"045011763810","page_count":66,"short_description":"Complaint","snippet":"         Case 1:25-cv-04164       Document 1   Filed 11/26/25     Page 1 of 66\n\n\n\n\n                   UNITED STATES DISTRICT COURT\n                   FOR THE DISTRICT OF COLUMBIA\n\n\n\nH.M., J.P., A.L., K.T., J.G., and C.L.\n\n                            Plaintiffs,\n                                               Civil Action No.\nv.\n\nUNITED STATES OF AMERICA,\n     SERVE:\n     Federal Tort Claims Act Section\n     Tort Branch, Civil Division\n     U.S. Department of Justice\n     950 Pennsylvania Ave. NW\n"}],"referredTo":null,"referred_to_id":null,"suitNature":"550 Prisoner Petition: Civil Rights (Other)","trustee_str":null},{"assignedTo":"Christopher Reid Cooper","assigned_to_id":719,"attorney":["Mark Steven Zaid","Bradley Prescott Moss"],"attorney_id":[10904672,11222402],"caseName":"SCHNITT v. BONDI","case_name_full":"","cause":"05:551 Administrative Procedure Act","chapter":null,"court":"District Court, District of Columbia","court_citation_string":"D.D.C.","court_id":"dcd","dateArgued":null,"dateFiled":"2025-11-24","dateTerminated":null,"docketNumber":"1:25-cv-04111","docket_absolute_url":"/docket/71952354/schnitt-v-bondi/","docket_id":71952354,"firm":["Law Offices of Mark S. Zaid, P.C."],"firm_id":[451451],"jurisdictionType":"U.S. Government Defendant","juryDemand":"Plaintiff","meta":{"timestamp":"2025-11-25T16:34:01.616409Z","date_created":"2025-11-24T16:36:33.332366Z","score":{"bm25":13440038000000.0},"more_docs":false},"pacer_case_id":"287099","party":["JOSEPH H. SCHNITT, III","PAMELA J. BONDI","DEPARTMENT OF JUSTICE","UNITED STATES OF AMERICA"],"party_id":[16732816,16732817,16732818,16801397],"recap_documents":[{"absolute_url":"/docket/71952354/1/schnitt-v-bondi/","attachment_number":null,"cites":[7245888],"description":"COMPLAINT against All Defendants with Jury Demand ( Filing fee $ 405 receipt number ADCDC-12096244) filed by JOSEPH H SCHNITT. (Attachments: # 1 Civil Cover Sheet Civil Cover Sheet, # 2 Summons Summons - Bondi, # 3 Summons Summons - DOJ, # 4 Summons Summons - USAO DC)(Zaid, Mark) (Entered: 11/24/2025)","docket_entry_id":445184061,"document_number":1,"document_type":"PACER Document","entry_date_filed":"2025-11-24","entry_number":1,"filepath_local":"recap/gov.uscourts.dcd.287099/gov.uscourts.dcd.287099.1.0.pdf","id":459872327,"is_available":true,"meta":{"timestamp":"2025-12-07T14:20:27.580748Z","date_created":"2025-11-24T16:36:37.174958Z"},"pacer_doc_id":"045011756926","page_count":23,"short_description":"Complaint","snippet":"           Case 1:25-cv-04111         Document 1        Filed 11/24/25      Page 1 of 23\n\n\n\n\n                            UNITED STATES DISTRICT COURT\n                                DISTRICT OF COLUMBIA\n\nJOSEPH H. SCHNITT, III1                      *\n                                             *\n                 Plaintiff,                  *\n                                             *\n        v.                                   *\n                                             *\nPAMELA J. BOND"}],"referredTo":null,"referred_to_id":null,"suitNature":"899 Administrative Procedure Act/Review or Appeal of Agency Decision","trustee_str":null},{"assignedTo":"J. Kate Stickles","assigned_to_id":15354,"attorney":["Maeghan J. McLoughlin","Eric R. Wilson","Michael A. Solimani","Randall L. Morrison","Malcolm M Bates","Justin R. Alberto","Joseph James McMahon, Jr.","Timothy Jay Fox, Jr.","Albert Kass","Seth Van Aalten","Laura Davis Jones","Peter J Keane","Carol E Thompson","Mary F. Caloway","Maxim B. Litvak","Stacy L. Newman","Jason R Adams","Sarah A. Carnes","Richard Gage","Edward A. Corma","David M. Bertenthal"],"attorney_id":[11256848,11262994,10907542,10954405,10954406,10954407,10954408,10954409,10954410,10954411,10954412,10954413,10954414,10954415,10954416,10954417,10954418,10954419,10902580,10952653,11113447],"caseName":"American Signature, Inc.","case_name_full":"","cause":"","chapter":"11","court":"United States Bankruptcy Court, D. Delaware","court_citation_string":"Bankr. D. Del.","court_id":"deb","dateArgued":null,"dateFiled":"2025-11-22","dateTerminated":null,"docketNumber":"25-12105","docket_absolute_url":"/docket/71950617/american-signature-inc/","docket_id":71950617,"firm":["Morris James LLP","Paul Hastings LLP","Office of the United States Trustee","Kirkland & Ellis LLP","Kelley Drye & Warren, LLP","Kelley Drye & Warren LLP","Kcc LLC Dba Verita Global","Xue Yu","C/O Kirkland & Ellis LLP","Pachulski Stang Young & Jones LLP","Pachulski Stang Ziehl & Jones","Paul Hasting","Pachulski Stang Ziehl & Jones LLP","Cole Schotz P.C.","Office of the U.S. Trustee","Paul Hastings"],"firm_id":[622468,679300,1084300,1084301,934674,50581,964501,879000,157602,1040058,64315,63812,64580,1099076,711,64711,63946,63823,1038415,783186,224729,347,64605,757355,715244],"jurisdictionType":"","juryDemand":"","meta":{"timestamp":"2025-12-15T18:06:30.051159Z","date_created":"2025-11-23T03:30:20.735108Z","score":{"bm25":13439866000000.0},"more_docs":false},"pacer_case_id":"199876","party":["U.S. Trustee","Reliable Companies","Official Committee of Unsecured Creditors","Kurtzman Carson Consultants, LLC dba Verita Global","American Signature, Inc."],"party_id":[16732737,16803075,16850213,16729245,16737309],"recap_documents":[{"absolute_url":"/docket/71950617/1/1/american-signature-inc/","attachment_number":1,"cites":[],"description":"Chapter 11 Voluntary Petition . Fee Amount $1738. Filed by American Signature, Inc.. (Attachments: # 1 Creditor Matrix) (Jones, Laura Davis) (Entered: 11/22/2025)","docket_entry_id":445109258,"document_number":1,"document_type":"Attachment","entry_date_filed":"2025-11-22","entry_number":1,"filepath_local":"recap/gov.uscourts.deb.199876/gov.uscourts.deb.199876.1.1.pdf","id":459794856,"is_available":true,"meta":{"timestamp":"2025-12-15T18:06:30.045321Z","date_created":"2025-11-23T04:04:44.141435Z"},"pacer_doc_id":"042022694554","page_count":665,"short_description":"Creditor Matrix","snippet":"                         Case 25-12105-JKS               Doc 1-1        Filed 11/22/25         Page 1 of 665\n\n\n\n\n                                                United States Bankruptcy Court\n                                                          District of Delaware\n In re   American Signature, Inc.                                                                Case No.\n                                                                     Debtor(s)                   Chapter      11\n\n\n\n\n      "}],"referredTo":null,"referred_to_id":null,"suitNature":"","trustee_str":""},{"assignedTo":"Nathanael M. Cousins","assigned_to_id":9087,"attorney":["Ronald Satish Emrit"],"attorney_id":[10900060],"caseName":"Emrit v. Wikipedia Search Engine","case_name_full":"","cause":"28:1331 Fed. Question: Tort Action","chapter":null,"court":"District Court, N.D. California","court_citation_string":"N.D. Cal.","court_id":"cand","dateArgued":null,"dateFiled":"2025-11-20","dateTerminated":null,"docketNumber":"5:25-cv-10031","docket_absolute_url":"/docket/71946202/emrit-v-wikipedia-search-engine/","docket_id":71946202,"firm":["Ronald Satish Emrit"],"firm_id":[241134],"jurisdictionType":"Federal Question","juryDemand":"Plaintiff","meta":{"timestamp":"2025-11-21T18:15:27.599932Z","date_created":"2025-11-21T17:56:03.257974Z","score":{"bm25":13439693000000.0},"more_docs":false},"pacer_case_id":"460161","party":["Google Search Engine Artificial Intelligence (AI)/Algorithm","New York Stock Exchange (NYSE)","Wikipedia Search Engine","ChatGPT","Ronald Satish Emrit","Nvidia","NASDAQ","Wikimedia","Standard & Poor's 500 (S&P 500)","Dow Jones Industrial Average (DJIA)","Presidential Committee/Political Action Committee/Separate Segregated Fund (SSF) Number C00569897","OpenAI","YouTube Search Engine"],"party_id":[16724544,16724545,16724533,16724534,16724535,16724536,16724537,16724538,16724539,16724540,16724541,16724542,16724543],"recap_documents":[{"absolute_url":"/docket/71946202/1/emrit-v-wikipedia-search-engine/","attachment_number":null,"cites":[],"description":"COMPLAINT (with Jury Demand) against ChatGPT, Dow Jones Industrial Average (DJIA), Google Search Engine Artificial Intelligence (AI)/Algorithm, NASDAQ, New York Stock Exchange (NYSE), Nvidia, OpenAI, Standard & Poor's 500 (S&P 500), Wikimedia, Wikipedia Search Engine, YouTube Search Engine. Filed by Presidential Committee/Political Action Committee/Separate Segregated Fund (SSF) Number C00569897, Ronald Satish Emrit. Consent/Declination due by 12/5/2025. (Attachments: # 1 Civil Cover Sheet)(kmm2, COURT STAFF) (Filed on 11/20/2025) (Entered: 11/21/2025)","docket_entry_id":444964476,"document_number":1,"document_type":"PACER Document","entry_date_filed":"2025-11-20","entry_number":1,"filepath_local":"recap/gov.uscourts.cand.460161/gov.uscourts.cand.460161.1.0.pdf","id":459645674,"is_available":true,"meta":{"timestamp":"2025-11-25T23:20:39.127164Z","date_created":"2025-11-21T18:01:53.272895Z"},"pacer_doc_id":"035026463913","page_count":15,"short_description":"Complaint","snippet":"Case 5:25-cv-10031-NC Document 1\n\nFiled 11/20/25 Page1of15\n\nIN THE UNITED STATES DISTRICT COURT FOR THE\nDISTRICT OF NORTHERN CALIFORNIA\n\n(280 South 1st Street, Room 2112, San Jose, CA 95113) (A)\nFILED\n\n)\n\nPresidential Candidate Number P60005535\n“also known as” (aka) Ronald Satish Emrit,\n& Presidential Committee/Political Action\nCommittee/Separate Segregated Fund (SSF)\nNumber C00569897 d/b/a United\nEmrits of America\n\nPlaintiffs (Pro Se)\n\nWikipedia Search Engine, Wikimedia,\n\nGoogle Search Engine A"}],"referredTo":null,"referred_to_id":null,"suitNature":"450 Commerce ICC Rates, Etc.","trustee_str":null},{"assignedTo":"Christopher Reid Cooper","assigned_to_id":719,"attorney":["DAVID B. WHEELER"],"attorney_id":[10919774],"caseName":"WHEELER v. BLANCHE","case_name_full":"","cause":"Civil Miscellaneous Case","chapter":null,"court":"District Court, District of Columbia","court_citation_string":"D.D.C.","court_id":"dcd","dateArgued":null,"dateFiled":"2025-11-17","dateTerminated":null,"docketNumber":"1:25-mc-00169","docket_absolute_url":"/docket/71978870/wheeler-v-blanche/","docket_id":71978870,"firm":["David B. Wheeler"],"firm_id":[1112497],"jurisdictionType":"Federal Question","juryDemand":"None","meta":{"timestamp":"2025-12-02T16:08:47.192046Z","date_created":"2025-12-01T21:34:46.086513Z","score":{"bm25":13439434000000.0},"more_docs":false},"pacer_case_id":"287242","party":["TODD BLANCHE","DAVID B. WHEELER","AMERICAN MUCKRAKERS PAC, INC."],"party_id":[16775185,16775182,16775183],"recap_documents":[{"absolute_url":"/docket/71978870/1/1/wheeler-v-blanche/","attachment_number":1,"cites":[112310],"description":"MOTION to Revoke Pro Hac Vice Admission of Todd Blanche by DAVID B. WHEELER. (Attachments: # 1 Memorandum in Support, # 2 Text of Proposed Order, # 3 Exhibit List, # 4 Exhibit A, # 5 Exhibit B, # 6 Exhibit C, # 7 Exhibit D, # 8 Exhibit E, # 9 Exhibit F, # 10 Exhibit G, # 11 Exhibit H, # 12 Exhibit I, # 13 Exhibit J, # 14 Exhibit K, # 15 Exhibit L, # 16 Exhibit M, # 17 Exhibit N, # 18 Exhibit O, # 19 Exhibit P, # 20 Exhibit R, # 21 Exhibit S, # 22 Exhibit T, # 23 Exhibit U, # 24 Exhibit V, # 25 Exhibit W)(znmw) (Entered: 12/01/2025)","docket_entry_id":445767465,"document_number":1,"document_type":"Attachment","entry_date_filed":"2025-11-17","entry_number":1,"filepath_local":"recap/gov.uscourts.dcd.287242/gov.uscourts.dcd.287242.1.1.pdf","id":461131543,"is_available":true,"meta":{"timestamp":"2025-12-08T01:59:26.741814Z","date_created":"2025-12-07T15:36:37.237135Z"},"pacer_doc_id":"045011766826","page_count":4,"short_description":"Memorandum in Support","snippet":"          Case 1:25-mc-00169-CRC           Document 1-1          Filed 11/17/25   Page 1 of 4\n\n                                 UNITED STATES DISTRICT COURT\n                                 FOR THE DISTRICT OF COLUMBIA\n\n\n\n                                            )\n    AMERICAN MUCKRAKERS PAC, INC., )\n    and                                     )\n    DAVID B. WHEELER, in his                )\n    Individual Capacity and as President of )\n    American Muckrakers PAC, Inc.           ) MISC. NO.: "},{"absolute_url":"/docket/71978870/1/3/wheeler-v-blanche/","attachment_number":3,"cites":[],"description":"MOTION to Revoke Pro Hac Vice Admission of Todd Blanche by DAVID B. WHEELER. (Attachments: # 1 Memorandum in Support, # 2 Text of Proposed Order, # 3 Exhibit List, # 4 Exhibit A, # 5 Exhibit B, # 6 Exhibit C, # 7 Exhibit D, # 8 Exhibit E, # 9 Exhibit F, # 10 Exhibit G, # 11 Exhibit H, # 12 Exhibit I, # 13 Exhibit J, # 14 Exhibit K, # 15 Exhibit L, # 16 Exhibit M, # 17 Exhibit N, # 18 Exhibit O, # 19 Exhibit P, # 20 Exhibit R, # 21 Exhibit S, # 22 Exhibit T, # 23 Exhibit U, # 24 Exhibit V, # 25 Exhibit W)(znmw) (Entered: 12/01/2025)","docket_entry_id":445767465,"document_number":1,"document_type":"Attachment","entry_date_filed":"2025-11-17","entry_number":1,"filepath_local":"recap/gov.uscourts.dcd.287242/gov.uscourts.dcd.287242.1.3.pdf","id":461131545,"is_available":true,"meta":{"timestamp":"2025-12-08T01:59:52.438491Z","date_created":"2025-12-07T15:36:37.464572Z"},"pacer_doc_id":"045011766828","page_count":4,"short_description":"Exhibit List","snippet":"          Case 1:25-mc-00169-CRC           Document 1-3       Filed 11/17/25     Page 1 of 4\n\n                                 UNITED STATES DISTRICT COURT\n                                 FOR THE DISTRICT OF COLUMBIA\n\n\n\n                                            )\n    AMERICAN MUCKRAKERS PAC, INC., )\n    and                                     )\n    DAVID B. WHEELER, in his                )\n    Individual Capacity and as President of )\n    American Muckrakers PAC, Inc.           ) MISC. NO.:  "}],"referredTo":null,"referred_to_id":null,"suitNature":"890 Other Statutory Actions","trustee_str":null}]}